product_name,core_terms,brand,stop_words,itemid,main_cat,weekly_orders
Mainan Anak Apple Learning Qur'an 6 tombol,Mainan ,,,90470618,45,16
PIE FACE GAME (Running Man games) / mainan anak,mainan ,,anak ,134074902,45,16
Mainan Masak Memasak Anak Barbie,Mainan ,,Anak ,60864373,45,16
MAINAN ANAK SUPERMARKET KASIR PLAY SET,MAINAN ,,ANAK ,147003535,45,16
Mainan Masak Memasak Edukasi Edukatif Anak Barbie Kichen Set,Mainan ,,"Anak,Set",61175041,45,16
Tempat Mandi Bola dengan Ring Basket / tidak termasuk bola / mainan anak / 500g per pcs,mainan ,,500g,76277265,45,15
WONDERLAND MERRY GO ROUND MUSIC DRUM MAINAN BAYI,MAINAN ,,BAYI,112973918,45,14
Mainan Anak / Bayi Model Buku Memperhatikan dari Kain untuk Pengembangan Kecerdasan,Mainan ,,"Anak,Bayi",76283075,45,14
Mainan Bola Karet Model Duri,Mainan ,,,110830694,45,13
Mainan Edukasi / Edukatif Anak Puzzle Kayu Balok - Menara geometri 5 bentuk,Mainan ,,Anak ,77314573,45,13
Mainan anak KITCHEN SET KOPER / edukasi,Mainan ,,anak,96264237,45,13
Hadiah Anak Mainan Memelihara Hewan Virtual Elektronik 49 Hewan Dalam 1 Menarik Lucu,Mainan ,,Anak ,76281366,45,13
WONDERLAND MERRY GO ROUND MUSIC DRUM BESAR - mainan bayi,mainan ,,bayi,139794886,45,12
(PROMO) Mainan Anak Cewek Kitchen Set Koper Warna Pink,Mainan ,,"Anak,Cewek,Set,Pink",11441171,45,12
Play Sand Pasir kinetik 1kg ( mainan anak pelampung kolam renang ),mainan ,,"1kg,anak",78444036,45,12
Mainan Anak / Bayi Model Buku Memperhatikan dari Kain untuk Pengembangan Kecerdasan,Mainan ,,anak ,76283075,45,12
Mainan Bola Plastik Mandi Bola Bahan Plastik Tebal Harga Promo SNI isi 22pcs,Mainan ,,"22pcs,Tebal ",170650704,45,11
Mainan Anak - Matras / Tikar / Alas Lantai / Evamat / Evamats Polos - Ukuran 30 - Puzzle,Mainan Anak,,Polos ,2434241,45,11
KITCHEN SET KOPER MAINAN ANAK / edukasi,MAINAN ANAK ,,"SET ,ANAK ",96279496,45,22
GASOL BUBUR BAYI MP ASI TEPUNG GASOL ORGANIK MAKANAN BAYI PENDAMPING ASI,MAKANAN ,,BAYI ,53415801,45,15
GASOL BUBUR BAYI MP ASI TEPUNG GASOL ORGANIK MAKANAN BAYI PENDAMPING ASI,MAKANAN BAYI,,BAYI ,53415801,45,17
Make Up Set Frozen 3 susun,Make Up,,Set,84917916,45,15
Minyak Kemiri Kukui Oil Original (Penyubur Rambut),Minyak,,,31790586,45,18
Minyak kemiri penyubur rambut anak & dewasa,Minyak,,anak,21537546,45,16
Kukui Minyak Kemiri Original,Minyak,,Kukui,49209005,45,14
Minyak dan Saripati Cantiqa Kemiri,Minyak ,,,47302843,45,39
Minyak Kayu Putih / Minyak Telon HUKI 125 ml,Minyak ,HUKI,125 ml,133649807,45,14
Konicare minyak telon plus 125ml 125 ml,minyak telon,Konicare ,125 ml,116507024,45,11
Minyak telon my baby plus 60 ml 90ml 150ml,Minyak telon ,my baby,"60 ml,90ml,150ml",133351952,45,33
My Baby Minyak Telon plus 90 ml,Minyak Telon ,My Baby,90 ml,130274971,45,23
Moby Baby MoonWalk : Alat Bantu Jalan Anak,MoonWalk ,Moby Baby,Anak ,6416816,45,12
Mukena Anak free tas bahan jersey import Adem,Mukena Anak ,,Adem,61988474,45,11
Ladang Lima Veggie Noodle Lengkap dengan Bumbu Non MSG,Noodle,Ladang Lima,dengan ,7727845,45,12
Ladang Lima Veggie Noodle Lengkap dengan Bumbu Non MSG,Noodle ,Ladang Lima,,7727845,45,11
Nosefrida - Alat Sedot Ingus,Nosefrida,,,16252701,45,13
Gerber Lil' Bits Oatmeal Banana Strawberry,Oatmeal ,Gerber ,,6978576,45,11
Bio Oil Penghilang Scar Streachmark Original 60ml,Oil,,"60ml,Original,Scar ",24124402,45,23
Casa Di Oliva Extra Virgin Olive Oil for Kids evoo,Olive Oil,Casa Di Oliva,Kids ,66476105,45,36
Evoo Casa di oliva / olive oil baby LAVBABY,olive oil, Casa di oliva,baby,48951273,45,31
Casa Di Oliva Extra Virgin Olive Oil for Kids evoo,Olive Oil,Casa Di Oliva,Kids ,66476105,45,15
Casa di Oliva - Olive Oil for Kids Exp Nov 2018,Olive Oil ,Casa di Oliva,"Kids,for ",7614100,45,26
Pakaian Anak / Bayi: Atasan Tanpa Lengan Bahan Jeans Denim + Rok Dress Motif Bunga-bunga,Pakaian Anak,,Lengan ,100799008,45,11
SHORT PANT STRIP,PANT ,,,53875443,45,16
SHORT PANT STRIP,PANT ,,,53875443,45,12
MAMYPOKO STANDAR PANTS S40/M34/L30/XL26/XXL24,PANTS,MAMYPOKO,"Anak,S40,M34,L30,XL26,XXL24 ",135993893,45,68
GOON Pants M62/L50/XL44 M 62/L 50/XL 44 M-62/L-50/XL-44,Pants,GOON,"M62,L50,XL44,M 62,L 50,XL 44,M-62,L-50,XL-44",67580547,45,58
GOON Pants M62/L50/XL44 M 62/L 50/XL 44 M-62/L-50/XL-44,Pants,GOON,"M62,L50,XL44,M 62,L 50,XL 44,M-62,L-50,XL-44",67580547,45,51
MAMYPOKO STANDAR PANTS S40/M34/L30/XL26/XXL24,PANTS,MAMYPOKO,,135993893,45,41
GOON Pants M62/L50/XL44 M 62/L 50/XL 44 M-62/L-50/XL-44,Pants,GOON ,"M62,L50,XL44,M 62,L 50,XL 44 M-62,L-50,XL-44",67580547,45,33
Mamypoko extra dry pants xl 26,pants,Mamypoko ,,138021592,45,27
Pampers premium pants M68 m 68,pants,Pampers ,,92927984,45,23
"MamyPoko Standar Pants Murah uk. S40, M34, L30 & XL26",Pants,MamyPoko ,,121169856,45,22
Fitti day pants m56 L 48 Promo ( 1- 15aret 2017),pants,,"m56,L 48",160237693,45,21
M62/L50/XL44/XXL36 GOON SLIM PANTS,PANTS,GOON ,"M62,L50,XL44,XXL36",80524667,45,21
MamyPoko pants standar S40 M34 L30 XL26 XXl24,pants,MamyPoko ,"S40,M34,L30,XL26,XXl24",69180233,45,19
Sweety Bronze Pants,Pants,,,156679122,45,19
Pampers Premium Care Pants M68 (Fix),Pants,Pampers ,,107925874,45,15
Hotpants warna 1-4th,pants,,1-4th,142483163,45,14
MAMYPOKO EXTRADRY M32 PANTS,PANTS,MAMYPOKO ,,60995033,45,13
MAMYPOKO JUNIOR XXXL24 PANTS FOR GIRL,PANTS,MAMYPOKO ,"XXXL24,FOR,GIRL",34822032,45,11
MAMYPOKO EXTRADRY PANTS L30,PANTS ,MAMYPOKO,,37103661,45,39
Mamypoko Pants Standar S40/M34/L30,Pants ,Mamypoko ,,14106046,45,38
Mamypoko Pants Standar S40/M34/L30,Pants ,Mamypoko ,"S40,M34,L30",14106046,45,36
Paket 3kg Pampers pants XL isi 7pcs,pants ,Pampers,"3kg ,7pcs,XL",106123410,45,28
Fitti day pants m56 L 48 Promo ( 1- 15aret 2017),pants ,,"m56,L 48",160237693,45,27
MAMYPOKO STANDAR PANTS S40/M34/L30/XL26/XXL24,PANTS ,MAMYPOKO,"S40,M34,L30,XL26,XXL24",135993893,45,27
Mamypoko M-XXL Pants Standard,Pants ,Mamypoko ,"M,XXL",73480437,45,23
Goo.n Slim Pants M62 / L50 / XL44 / XXL36,Pants ,,,168005370,45,22
Sweety Pants Bronze M34+4,Pants ,Sweety ,,150975984,45,22
MAMYPOKO STANDAR PANTS S40/M34/L30/XL26/XXL24,PANTS ,MAMYPOKO ,"S40,M34,L30,XL26,XXL24",135993893,45,21
Mamy Poko Pants Standar L 30,Pants ,Mamy Poko,L 30,27424799,45,20
MAMYPOKO EXTRA DRY PANTS S38/M32/L30/XL26/XXL22,PANTS ,MAMYPOKO ,"S38,M32,L30,XL26,XXL22",136007374,45,20
Mamypoko pants extra dry M32/L30/XL26/Xxl22,pants ,Mamypoko ,"M32,L30,XL26,Xxl22",152572800,45,20
"Mamypoko Pants Extra Dry M32, L30, XL26, XXL22",Pants ,Mamypoko,"M32, L30, XL26, XXL22",3719110,45,20
MAMYPOKO STANDAR PANTS S40/M34/L30/XL26/XXL24,PANTS ,MAMYPOKO ,"S40,M34,L30,XL26,XXL24",135993893,45,20
MamyPoko Pants Extra Dry L30,Pants ,MamyPoko ,L30,147146269,45,20
Mamypoko Pants Standar XL26 / XXL24,Pants ,Mamypoko ,"XL26 , XXL24",124844320,45,19
MAMYPOKO STANDAR PANTS S40/M34/L30/XL26/XXL24,PANTS ,MAMYPOKO ,"S40,M34,L30,XL26,XXL24",135993893,45,18
Mamypoko extra dry pants L30,pants ,Mamypoko ,L30,140360699,45,18
Genki! Nepia genki premium soft pants M 32 M32 L 30 L30 XL 26 XL26 XXL 18 XXL18,pants ,Genki!,"M 32,M32,L 30,L30,XL 26,XL26,XXL 18,XXL18",122494719,45,17
"Mamypoko Pants Extra Dry M32, L30, XL26, XXL22",Pants ,Mamypoko ,"M32, L30, XL26, XXL22",3719110,45,16
MAMYPOKO NIGHT PANTS JUNIOR BOYS XXXL24,PANTS ,MAMYPOKO ,"BOYS,XXXL24",35353908,45,16
MAMYPOKO EXTRA DRY PANTS S38/M32/L30/XL26/XXL22,PANTS ,MAMYPOKO ,"S38,M32,L30,XL26,XXL22",136007374,45,16
Mamy poko junior night pants xxxl 24 boys,pants ,Mamy poko,"xxxl, boys",42680090,45,16
Short pants OSHKOSH / celana pendek laki / baju anak / pakaian anak / grosir baju anak branded,pants ,OSHKOSH ,"laki ,anak ",63038338,45,15
Sweety Bronze Pants XL 26 + 4,Pants ,Sweety ,XL,125373317,45,15
2PCS + REFUND MAMYPOKO STANDAR PANTS S40/M34/L30/XL26/XXL24,PANTS ,MAMYPOKO ,"S40,M34,L30,XL26,XXL24",147510541,45,14
MAMY POKO JUNIOR NIGHT PANTS XXXL 24,PANTS ,MAMY POKO,XXXL ,113715229,45,14
Merries Pants Good Skin L30,Pants ,Merries ,Skin ,15851652,45,13
Hotpant carter's,pants ,carter's,,63788832,45,13
Sweety Bronze Pants L 30 + 4,Pants ,Sweety ,,125371768,45,13
MAMYPOKO EXTRA DRY PANTS S38/M32/L30/XL26/XXL22,PANTS ,MAMYPOKO,"S38,M32,L30,XL26,XXL22",136007374,45,13
Pampers Premium Pants XL 54,Pants ,Pampers ,XL 54,90949565,45,13
Training Pants Import Animals,Pants ,,Animals,44591218,45,13
Mamy Poko Pants Standar M 34,Pants ,Mamy Poko,,27425281,45,12
MamyPoko Pants Standar S40/ M34/ L30,Pants ,MamyPoko,"S40,M34,L30",78614476,45,12
"MamyPoko Standar Pants Murah uk. S40, M34, L30 & XL26",Pants ,MamyPoko ,"S40,M34,L30 ,XL26",121169856,45,12
Fitti day pants M56 L48,pants ,,"M56,L48",166527733,45,11
Sweety Bronze Pants S36+4,Pants ,Sweety ,,156777315,45,11
Short pants denim / celana pendek anak denim,pants ,,"pendek,anak ",41332077,45,11
Pampers Premium Care Pants L62,Pants ,Pampers ,L62,130590817,45,11
MAMYPOKO EXTRA DRY PANTS S38/M32/L30/XL26/XXL22,PANTS ,MAMYPOKO ,"S38,M32,L30,XL26,XXL22",136007374,45,11
Sweety Bronze Pants,Pants ,Sweety ,,156679122,45,11
Mamy Poko Pants Extra Dry c,Pants ,Mamy Poko,L 30,148946097,45,11
Promo Mamypoko pants extra dry extradry S M L XL XXL S38 M32 L30 XL26 XXL22,pants ,Mamypoko ,"S,M,L,XL, XXL,S38,M32,L30,XL26,XXL22",58773885,45,11
Pampers premium pants L62 L 62 M68 M 68,pants ,Pampers ,"L62,L 62,M68,M 68",139904430,45,11
Promo! Mamypoko pantz extra dry,pantz ,Mamypoko ,,129238726,45,19
Pasir Kinetik Set (Pasir 2 kg)- cetakan 21-24 pcs,Pasir Kinetik,,2 kg,156587254,45,16
READY !!!! Pasir kinetik paket 2kg,Pasir kinetik,,2kg,19078870,45,13
[AHM029] Pelindung Pengaman Bayi dari Perabotan Rumah,Pelindung Bayi ,,"Anak,Polos",29041653,45,12
Citric acid Pembersih Steril LAVBABY,Pembersih ,,Citric acid,16178535,45,14
USB Elektrik Pemompa Payudara dengan Bubee nyata ganda dan botol susu untuk penampung ASI,Pemompa Payudara,,ganda,68264088,45,23
talking pen poca,pen,,,63259506,45,26
Pengaman Laci / pengaman kulkas / pengaman kloset / pengaman lemari,Pengaman ,,,9966933,45,11
"lovelygubuk pengaman colokan listrik, pengaman listrik",pengaman colokan ,,,51330875,45,12
jaring pengaman kipas angin/jaring penutup kipas angin baby safety/jaring kipas as,penutup kipas,,"baby,safety",56141721,45,11
Perlak Bayi / Perlak Ompol / Mattress Protector Motif Random KDE060,Perlak,,Bayi,27592218,45,46
Musical Celuler Phone,Phone,,,57200363,45,12
(PROMO) Animal Farm Piano,Piano,,Animal ,45434884,45,14
piyama label gymbore 2.3.4 t bahan cvc polibag 1 per 1 post,piyama,,,130301533,45,21
KAZEL SETELAN PIYAMA GIRL ( 3 PASANG ),PIYAMA,,"GIRL,3 PASANG",139936003,45,13
"PROMO VELVET "" SEA LION "" Setelan Pendek Velvet Junior SML XL XXL Baju Bayi Piyama",Piyama,,"Bayi,Setelan,Pendek",29154092,45,12
Piyama / baju tidur anak size xs,Piyama,,,85162299,45,12
BIG PROMOOOOOOO Piyama gerry kids (xs 0-1th),Piyama,gerry,"xs 0-1th,kids ",29988649,45,11
KAZEL SETELAN PIYAMA BOY ( 3 STEL ),PIYAMA ,KAZEL ,BOY ,139938757,45,20
KAZEL SETELAN PIYAMA BOY ( 3 STEL ),PIYAMA ,KAZEL ,BOY ,139938757,45,18
Piyama / baju tidur anak size S,Piyama ,,"anak,size S",85175453,45,18
OBRAL UKURAN XS Piyama Anak Katun,Piyama ,,"Anak,XS",125905878,45,16
BIG PROMOOOOOOK Piyama gerry kids (size S 2-3th),Piyama ,gerry kids,"size S,2-3th",29986218,45,14
LIBBY PUZZLE MOTIF BARU Setelan Panjang Piyama Bayi Libby ukuran Newborn Bayi baru lahir 0-3bulan,Piyama ,LIBBY ,Bayi ,49486667,45,12
Piyama / baju tidur anak size S,Piyama ,,"anak,size S",85175453,45,12
4 PCS PIYAMA ANAK BABY 1 TAHUN SAMPAI 7 TAHUN,PIYAMA ,,"ANAK,BABY,4 PCS",118832156,45,11
Piyama / baju tidur anak size L,Piyama anak ,,size L,82877285,45,11
Playpad anak Muslim iPad Arab 4 bahasa / playpad Arab 4 bahasa,Playpad,,"anak, Arab ",91605145,45,53
(Free Baterai & Dus) Mainan Playpad Music iPad Arab 4 Bahasa/Laptop Arab,Playpad,,Arab,20958150,45,46
(PROMO) IPAD MUSLIM Playpad harga GROSIR,Playpad,,,11441461,45,32
"Playpad Anak Muslim 4 Bahasa With LED ,Playpad Arab",Playpad,,"Anak,Arab",56234115,45,28
Playpad anak Muslim iPad Arab 4 bahasa / playpad Arab 4 bahasa,Playpad,,"anak ,Arab ",91605145,45,28
(PROMO) Playpad Anak Muslim 3 Bahasa iPad Arab + Layar Papan Tulis + Piano,Playpad,,"Anak,Arab ",37353511,45,22
Mainan Playpad Arab Anak Muslim 4 Bahasa Led Anti Gores,Playpad,,"Anak,Arab ",118433532,45,11
Playpad Anak Muslim 3 Bahasa iPad Arab + Layar Papan Tulis + Piano,Playpad ,,"Anak ,Arab ",94901248,45,32
(PROMO) IPAD MUSLIM Playpad harga GROSIR,Playpad ,,,11441461,45,17
Playpad anak Muslim iPad Arab 4 bahasa / playpad Arab 4 bahasa,Playpad ,,"anak,Arab ",91605145,45,16
"Playpad Anak Muslim 4 Bahasa With LED ,Playpad Arab",Playpad ,,"Anak ,Arab",56234115,45,14
MAINAN PLAYPAD MUSLIN 4 BAHASA,PLAYPAD ,,,91624074,45,11
"Playpad Anak Muslim 4 Bahasa With LED , Playpad Arab",Playpad ,,"Anak,Arab",99046902,45,11
playpad arab 3 bahasa papan tulis versi baru,playpad ,,"baru,versi ",37015606,45,11
minimo playsuit grosir 10 pcs,playsuit ,minimo ,10 pcs,114313000,45,17
Size S Jegging Pocket,Pocket,,Size S,36592642,45,14
Size M jegging Pocket,Pocket,,Size M,106617406,45,12
Spectra Valve Membran / Valve pompa asi spectra 9plus all spectra LAVBABY,pompa asi,Spectra Valve,9plus,14463771,45,20
Pompa ASI Bubeen Model Elektrik dengan Bubeen Ganda Asli dilengkapi Botol,Pompa ASI,,Ganda ,105429705,45,16
Pompa Payudara Ibu Model Elektrik Usb Dengan Botol Susu,Pompa Payudara,,Ibu ,102165784,45,42
Alat Pompa Silikon Manual Portable Bebas BPA Untuk ASI,Pompa Silikon ,,"Portable,Untuk ",69696234,45,23
Popok Handuk Bayi / Popok Kain Bayi Lapis Handuk / Popok Double KDE039,Popok,,"Bayi,Double ",21543844,45,27
POPOK KATUN FULLPRINT,POPOK,,,24085545,45,13
Pampers Popok Diapers Premium Care Active Baby Tape - M 40,Popok,Pampers ,,151721169,45,13
Popok Bayi / Popok Alas / Popok Ikat Tali / Popok Putih Sablon KDE025,Popok ,,"Putih ,Bayi ",21538447,45,37
Popok Bayi / Popok Alas / Popok Ikat Tali / High Grade TC Filla KDE034,Popok ,,Bayi ,21542734,45,18
FREE ONGKIR S48 / M40 PAMPERS PREMIUM CARE Taped M 40 / Size S isi 48 Perekat New Baby Popok Bayi,Popok ,PAMPERS ,"Bayi,Baby,Size S isi 48 ",81727793,45,15
Popok Bayi Libby 3 pcs (Motif / Warna),Popok ,Libby ,"Bayi,3 pcs",85114722,45,12
Libby Popok tali mix,Popok ,Libby ,,122825411,45,12
Goon premium tape excellent dry NB48 S44 M38 popok bayi baru lahir nb 48 s 44 m 38,popok ,Goon ,"nb 48,s 44,m 38",130059679,45,11
POPOK BAYI POLOS @SHANKUSEN,POPOK ,,"BAYI,POLOS ",112898050,45,11
(PROMO) quran apple / apple qur'an untuk belajar anak,qur'an,,anak,44655747,45,54
Mainan Anak Apple Learning Qur'an 6 tombol,Qur'an ,,,90470618,45,13
quran apple / apple qur'an untuk belajar anak 6 tombol,qur'an ,,,46877373,45,11
(PROMO) quran apple / apple qur'an untuk belajar anak,quran,,anak,44655747,45,51
APPLE QURAN / Apple Learning Quran 6 tombol / edukasi,QURAN,,,114338554,45,31
APPLE QURAN / Apple Learning Quran 6 tombol / edukasi,Quran,,,114338554,45,21
Mainan Apple Learning Quran Machine,Quran,,,94122627,45,17
APPLE QURAN / APPLE LEARNING QURAN 6 tombol / edukasi,QURAN,,,158411206,45,16
APPLE QURAN / Apple Learning Quran 6 tombol / edukasi,QURAN,,,114340857,45,15
APPLE QURAN / Apple Learning Quran 6 tombol / edukasi,QURAN,,,114338554,45,15
apple learning quran,quran,,,44321775,45,12
APPLE LEARNING QURAN,QURAN,,,31939408,45,11
Mainan Apple Learning Quran Machine,Quran ,,,94122627,45,14
APPLE QURAN / Apple Learning Quran 6 tombol / edukasi,Quran ,,,114338554,45,13
APPLE QURAN / APPLE LEARNING QURAN 6 tombol / edukasi,QURAN ,,,158411206,45,12
Apple Learning Quran / Alat Bantu Belajar Quran,Quran ,,,123061537,45,11
APPLE QURAN / Apple Learning Quran 6 tombol / edukasi,QURAN ,,,114338554,45,11
APPLE QURAN / Apple Learning Quran 6 tombol / edukasi,QURAN ,,,114338554,45,11
Raglan anak tanggung,Raglan,,,74236886,45,31
Terbaik !!! Raglan Anak 3/4 Harga Pabrik Gratis Sablon Nama Atau Tulisan,Raglan,,Anak ,48040449,45,26
Raglan polos,Raglan ,,polos,57483100,45,23
ROK TUTU GEMBUL PANT MINI,ROK TUTU ,,MINI,19533800,45,29
Sebamed Baby Cleansing Bar / Sebamed Cleansing Bar / Sabun Batang,Sabun ,Sebamed ,Baby ,119566509,45,17
PAKET SARUNG INSTAN+PECI+BAJU KOKO MERK ORANGE,SARUNG ,ORANGE,,7514460,45,16
"SARUNG INSTAN BALITA merk ""anak sholeh""",SARUNG ,anak sholeh,"INSTAN, BALITA",109868200,45,11
Sarung Tangan Dan Kaos Kaki Bayi Halus Warna Polos Model Pita KDE056,Sarung Tangan,,"Kaki, Bayi ,Polos ",25099215,45,49
Sarung Tangan Dan Kaki Bayi / Kaos Tangan Dan Kaki Bayi Newborn KDE031,Sarung Tangan,,Bayi,21542207,45,30
SARUNG TANGAN + KAKI POLKADOT,SARUNG TANGAN,,,20922510,45,19
6 set SARUNG TANGAN+KAKI BAYI @VANDA,SARUNG TANGAN,,6 set ,87210483,45,15
Sarung Tangan Kaki Warna ( KARET ),Sarung Tangan,,,90886134,45,12
Pliko Fold Up Infant Seat,Seat,Pliko,,120684398,45,12
JBS ECO Sugar Baby Infant Seat Bouncer,Seat Bouncer,Sugar Baby,,14005366,45,11
Selimut double fleece carter,Selimut,carter,double,71858380,45,123
Selimut Carter Double Fleece Baby Blanket,Selimut,Carter ,"Double,Baby ",118743744,45,17
Selimut double fleece carter,Selimut ,,double ,98330446,45,20
SELIMUT TOPI KARAKTER CARTER,SELIMUT ,,,140239538,45,19
PALING MURAH !!! Selimut topi karakter carter / Selimut 3D Carter,Selimut ,Carter,,65643692,45,15
Sepatu Sekolah / Olahraga / Adidas Yeezy Anak Inspired / LED Knit Sneaker Shoes,Sepatu,Adidas ,"Anak,",60354337,45,29
(FREE ONGKIR) Sepatu Sekolah Anak Lampu / Adidas Yeezy / LED Knit Shoes,Sepatu,Adidas,Anak,157361318,45,24
Sepatu Anak Converse Kids Low,Sepatu,,,57470688,45,15
Sepatu Sekolah / Olahraga / Adidas Yeezy Anak Inspired / LED Knit Sneaker Shoes,Sepatu,Adidas,,60354337,45,14
Sepatu Roda Anak Inline,Sepatu ,Inline,Anak ,78647275,45,23
Sepatu Sekolah / Olahraga / Adidas Yeezy Anak Inspired / LED Knit Sneaker Shoes,Sepatu ,Adidas ,"Anak, LED",60354337,45,20
SKIDDER / skider prewalker sepatu anak bayi skidders shoes,sepatu ,SKIDDER ,"anak,bayi",155936473,45,18
Sepatu Sekolah / Olahraga / Adidas Yeezy Anak Inspired / LED Knit Sneaker Shoes,Sepatu ,Adidas ,Anak ,60354337,45,15
Yezzy Shoes LED Size 21-35 / Sepatu Anak / Sepatu Lampu,Sepatu ,,"Anak ,Size 21-35",134329785,45,15
Sepatu Sekolah / Olahraga / Adidas Yeezy Anak Inspired / LED Knit Sneaker Shoes,Sepatu ,Adidas ,Anak ,60354337,45,13
Sepatu Sekolah / Olahraga / Adidas Yeezy Anak Inspired / LED Knit Sneaker Shoes,Sepatu ,Adidas ,Anak ,60354337,45,13
Sepatu Sekolah / Olahraga / Adidas Yeezy Anak Inspired / LED Knit Sneaker Shoes,Sepatu ,Adidas ,Anak ,60354337,45,11
RESTOCK ALL COLOUR! Sepatu Casual / Olahraga Anak / Adidas Superstar Inspired Anak / Stripe Shoes,Sepatu ,Adidas,"Casual,Anak",29192045,45,11
SEPATU KIDS / ANAK ADIDAS SPRING EDITION,SEPATU ANAK ,ADIDAS ,,101092315,45,12
Babeebabyshop BLACK WING PREWALKER SHOES prewalkerbayi prewalkeranak SEPATU BAYI IMPOR SEPATU,SEPATU BAYI ,,BLACK,10819740,45,22
Sepatu Roda Anak Power Berkualitas,Sepatu Roda,,Anak ,123933219,45,18
Sepatu Roda Anak Inline,Sepatu Roda,,Anak ,78647275,45,18
Sepatu Roda Anak Inline,Sepatu Roda,Inline,Anak ,78647275,45,16
Sepatu Roda Anak Inline,Sepatu Roda,Inline,Anak ,78647275,45,14
Sepatu Roda Anak Inline,Sepatu Roda,Inline,Anak,78647275,45,14
Fullset sepatu roda anak / inline skate bisa roda bajaj,sepatu roda,inline ,anak ,130846252,45,14
Sepatu Roda Anak Inline,Sepatu Roda,Inline,Anak,78647275,45,13
Sepatu Roda Anak Inline,Sepatu Roda ,Inline,Anak ,78647275,45,16
Sepatu Roda Anak Inline,Sepatu Roda ,,,78647275,45,12
"PROMO VELVET "" SEA LION "" Setelan Panjang Velvet Junior ukuran SML LL XL XXL",Setelan ,SEA LION,"Panjang,Velvet,SML LL XL XXL",29211607,45,20
Setelan Hello Kitty uk. 2-3 th / Setelan Anak Cewek Kaos Anak Celana Anak Murah Leging Pants,Setelan ,,"2-3 th,Cewek ",94780205,45,12
Skidder Shoes / Sepatu Kaos Kaki / Sepatu Bayi / Sepatu Skidder / Skidders Shoes,Shoes ,,"Bayi,Skidders ",64103395,45,20
LED Knit Sneaker Shoes No 21-35 - Black White / Pink / All Black / Blue,Shoes ,,"No 21-35,Black White,Pink ,All Black, Blue",100406988,45,15
LED Knit Sneaker Shoes No 21-35 - Black White / Pink / All Black / Blue,Shoes ,,"No 21-35,Black White ,Pink , All Black ,Blue",100406988,45,14
LED Knit Sneaker Shoes No 21-35 - Black White / Pink / All Black / Blue,Shoes ,,"No 21-35 ,Black White,Pink,All Black,Blue",100406988,45,13
HAHA A062 Topi keramas kancing anak kid shower cap mata shampoo sabun mandi bath,shower cap,,"anak,kid,mata ",61735469,45,23
HAHA A062 Topi keramas kancing anak kid shower cap mata shampoo sabun mandi bath,shower cap,,anak ,61735469,45,16
sikat jari iq baby sikat gigi bayi sikat lidah,sikat gigi bayi,iq baby,jari ,37407155,45,11
AHM030 - Pelindung Siku Meja Silikon Transparan Bayi & Anak,Silikon ,,"Bayi , Anak",29013714,45,20
Slabber / Tatakan Iler (slaber) Carter,Slabber ,,Carter,154474790,45,16
"lovelygubuk slabber bayi 3d, celemek makan bayi dengan kantong, slaber binatang 3d",slabber ,lovelygubuk ,bayi,47942674,45,12
3 pcs Slaber segitiga bibs koboy celemek makan lap iler bayi,Slaber,,"segitiga,bayi,3 pcs",51042743,45,13
Slaber Carter,Slaber ,Carter,,18148259,45,23
"lovelygubuk Celemek air liur, slaber makan bayi bahan EVA, celemek makan bayi",Slaber ,lovelygubuk ,bayi,33721858,45,15
"lovelygubuk Celemek air liur, slaber makan bayi bahan EVA, celemek makan bayi",slaber ,,bayi ,33721858,45,13
Sleepsuit libby,Sleepsuit ,,,76663911,45,19
Sleepsuit libby,Sleepsuit ,libby,,76663911,45,17
"TERBARU VELVET "" SEA LION "" Sleepsuit Jumper Bayi Newborn baju tidur",Sleepsuit ,SEA LION,Bayi ,54449917,45,14
LIBBY PPREMIUM 3pcs Sleepsuit (GIRL) dengan Sarung Tangan,Sleepsuit ,LIBBY ,"3pcs,GIRL,Tangan",58013147,45,12
36B31 Libby Sleespuit Boy 3-6 Bulan,Sleespuit,Libby ,"Boy,3-6 Bulan",159963760,45,12
Yummy Bites Baby Rice Crackers Snack Bayi Biskuit Bayi,Snack ,Yummy Bites,"Baby,Bayi",44067367,45,14
Yummy Bites Baby Rice Crackers Snack Bayi Biskuit Bayi,Snack Bayi,Yummy Bites,Baby ,44067367,45,11
Sprei waterproof bahan pvc uk 180x200,Sprei ,,180x200,20882706,45,14
SQUISHY GIGI PACKING PLASTIK IMPORT,SQUISHY,,,112722495,45,26
SQUISHY PANDA BUN MINI,SQUISHY,,"PANDA,MINI",67712579,45,20
SQUISHY MEDIUM PANDA BUN,SQUISHY,,PANDA ,67710350,45,14
SQUISHY JUMBO HAMBURGER WIJEN,SQUISHY,,JUMBO,81812355,45,14
SQUISHY.JUMBO WORTEL,SQUISHY,,,76821552,45,11
SQUISHY PAKET SPESIAL SLOW RISING ISI 5 PCS (Mainan Anak) PROMO SPESIAL!!!,SQUISHY ,,"Anak,5 PCS",33198987,45,11
Kursi Makan Family Kursi Dorong Family Chair Stroller,Stroller,,,107738775,45,12
( NEW ) Stroller anak Micro Trike Portable,Stroller ,,"Portable,anak ",66331613,45,12
Stroller Anak Micro Trike Portable,Stroller ,,"Anak ,Portable",67534727,45,12
Kursi Makan Bayi Chair Stroller Family (stroller kursi) fc 8288,Stroller ,,Bayi ,46855710,45,11
Susu Mama Soya,Susu ,,,107188155,45,14
Susu Pediasure Complete 850 gr,Susu ,Pediasure ,850 gr,165951129,45,12
Sweater oshkosh,Sweater,oshkosh,,150207801,45,30
Ecer / Size S / Sweater Anak / Jaket Anak / Cardigan Anak / Kaos Lengan Panjang,Sweater ,,"Anak,Mini,Polos",64663281,45,12
3pcs@39 Tanktop polka,Tanktop,,3pcs,172192482,45,12
Pampers premium care tape S-48 / S48 / S 48,tape,Pampers,"S-48 , S48 , S 48",126816245,45,19
Pampers Premium Care Tape S48,Tape ,Pampers,,12031631,45,15
Genki! Nepia genki premium soft tape S 72 S72 M 64 M64,tape ,Genki!,,122506843,45,13
"Goon Excellent Dry Tape M68, L58, XL50",Tape ,Goon ,"M68, L58, XL50",7904109,45,12
Tas Bantal Guling Gendongan Alas Tidur Perlak Bayi Set 4 in 1 Chekiddo,Tas ,Chekiddo,"Bayi,4 in 1",2312935,45,15
Snobby Tas Bayi Kecil Saku Kerut Line Series TPT1672,Tas ,Snobby,Bayi ,108395493,45,12
Tas Bayi Snobby Besar Saku Tempat Botol Susu Giraffe Series,Tas Bayi,Snobby ,"Besar,Giraffe ",45893242,45,11
Tas Bayi Besar Snobby Double Saku Amazing Gray Plus Tempat Botol,Tas Bayi ,Snobby ,"Bayi,Double,Amazing,Gray ",68551283,45,33
Tas Gendongan Bantal Guling Alas Tidur Bayi Set 4 in 1 Chekiddo,Tas Gendongan,Chekiddo,,125869032,45,41
Tas Gendongan Bantal Guling Alas Tidur Bayi Set 4 in 1 Chekiddo,Tas Gendongan,Chekiddo,Bayi ,125869032,45,38
Tas Gendongan Bantal Guling Alas Tidur bayi Set 4 in 1 Merk Chekiddo,Tas Gendongan ,Chekiddo,bayi,22269915,45,59
Tas Gendongan Bantal Guling Alas Tidur Bayi Set 4 in 1 Chekiddo,Tas Gendongan ,Chekiddo,"bayi,Set ",125869032,45,52
ASI BOOSTER TEA,TEA,,,33499553,45,24
(FREONG) ASI BOOSTER TEA,TEA,,,28465516,45,24
SPECIAL PRICE Asi Booster Tea - Teh Pelancar Asi,Tea ,,,33771368,45,29
TERLARIS !! CANDY DAN RUFFLE TEE SPANDEK RAYON HIGH QUALITY,TEE,,,16025214,45,18
TERLARIS !! CANDY DAN RUFFLE TEE SPANDEK RAYON HIGH QUALITY,TEE ,,,16025214,45,12
Iq Baby Teether 2 in 1 Silicone and Toothbrush Gigitan Bayi,Teether,Iq Baby,Bayi,67078092,45,11
Teether Book Carter,Teether ,Carter,,70445795,45,11
My Baby Telon Plus 150ml,Telon,My Baby,150ml,122773692,45,11
TENDA ANAK,TENDA,,ANAK,32752876,45,15
"Tenda anak anak camping / tempat main anak anak ! Motif frozen , winnie the pooh , cars , mickey !",Tenda ,,anak,11732073,45,19
Tenda Terowongan Super Tent,Tenda ,,,56180386,45,19
"Tenda anak anak camping / tempat main anak anak ! Motif frozen , winnie the pooh , cars , mickey !",Tenda ,,anak ,11732073,45,16
CAMP TENT / TENDA ANAK,TENDA ,,ANAK,102825979,45,15
Tenda Anak Terowongan + Kolam,Tenda ,,Anak ,163549772,45,13
Baby Crown Digital Termometer Bayi,Termometer ,Baby Crown,Bayi,23840177,45,19
Thermometer Termometer Infrared Alat Ukur Suhu Badan,Termometer ,,,80757907,45,15
Crown Digital Thermometer / Termometer,Thermometer ,Crown ,,53635293,45,11
KURSI MAKAN BAYI PLIKO dan MASTELA dan BABYDOES dan BABYSAFE ---- FOLDING BOOSTER/TODDLER SEAT --,TODDLER SEAT,"PLIKO,MASTELA,BABYDOES,BABYSAFE",BAYI ,32106792,45,12
Nuby Banana Toothbrush Teether Nananubs Massager,Toothbrush,,,90229842,45,21
IQ Baby 2 in 1 Corn Silicone Teether and Toothbrush,Toothbrush,IQ Baby,2 in 1,65103043,45,12
VIP - Jack N Jill Toothpaste / Odol Organik Anak Rasa Strawberry,Toothpaste ,Jack N Jill,Anak ,3271437,45,16
TOPI CARTER SERI BOY,TOPI,,BOY,20733980,45,18
topi mj anak kupluk mj anak ori/mj hat kids/mj anak dan bayi/topi kupluk anak bayi like,topi,,"anak,bayi",48295730,45,12
topi mj anak kupluk mj anak ori/mj hat kids/mj anak dan bayi/topi kupluk anak bayi like,topi ,,"anak,kids,bayi",48295730,45,18
"[Lovelygubuk]Topi bonnet bayi, topi dutch lady bayi, topi putri anak",Topi ,Lovelygubuk,"bayi,anak,lady ",161366877,45,16
