product_name,core_terms,brand,stop_words,itemid,main_cat,weekly_orders
TOPI CARTER SERI GIRL,TOPI ,CARTER ,GIRL,20732586,45,15
Topi Keramas Anak,Topi ,,Anak,71375408,45,14
Topi Bayi / Topi Strawberry / Topi Kupluk / Aneka Topi Bayi KDE054,Topi ,,Bayi ,27591039,45,13
topi mj anak kupluk mj anak ori/mj hat kids/mj anak dan bayi/topi kupluk anak bayi like,topi ,,"anak,bayi ",48295730,45,12
topi mj anak kupluk mj anak ori/mj hat kids/mj anak dan bayi/topi kupluk anak bayi like,topi ,,"anak,kids",48295730,45,11
Fashion Bayi: Barang Termurah Topi Rajut Hangat Desain Dua Bola Untuk Anak Laki-laki Perempuan,Topi Rajut ,,"Anak,Laki-laki,Perempuan,Bayi",76283493,45,23
Topi Kupluk Musim Dingin Anak Bayi Perempuan Bahan Rajut Crochet Tangan Hangat Berhiaskan Bunga,Topi Rajut ,,"Anak,Bayi,Perempuan",76283087,45,11
KAZEL TSHIRT PANDA GIRL ( ISI 6 PCS ),TSHIRT,KAZEL ,"PANDA,GIRL,6 PCS",72793068,45,18
KAZEL TSHIRT PANDA GIRL ( ISI 6 PCS ),TSHIRT ,KAZEL,"PANDA ,GIRL ,PCS",72793068,45,24
KAZEL TSHIRT PANDA GIRL ( ISI 6 PCS ),TSHIRT ,,"PANDA ,GIRL,6 PCS",72793068,45,21
SALE KAZEL TSHIRT PANDA EDITION,TSHIRT ,,PANDA ,53544476,45,16
KAZEL TSHIRT PANDA GIRL ( ISI 6 PCS ),TSHIRT ,,"PANDA,GIRL,6 PCS",72793068,45,15
KAZEL TSHIRT PENGUIN NEW EDITION TERMURAH ( 1 BOX = 6 PCS ),TSHIRT ,KAZEL ,"6 PCS,",93776917,45,13
KAZEL TSHIRT PANDA GIRL ( ISI 6 PCS ),TSHIRT ,KAZEL ,"PANDA,GIRL,6 PCS",72793068,45,13
KAZEL TSHIRT PANDA GIRL ( ISI 6 PCS ),TSHIRT ,KAZEL,"PANDA,GIRL, 6 PCS",72793068,45,12
Tunik Anak Perempuan (MIN 3 PCS),Tunik,,"Anak,Perempuan,3 PCS",89312002,45,15
Tunik Flower Kids / dress Flower Kids / baju anak / pakaian anak / grosir baju anak branded,Tunik ,,"anak,Kids ",73133376,45,46
Sapu Tangan (washcloth) gerber 8 in 1 motif Random Berubah terus,washcloth,gerber ,8 in 1,91028455,45,16
Gerber washcloth wash cloth saputangan bayi LAVBABY,washcloth ,Gerber,bayi,95966566,45,13
Waslap Bayi / Washlap / Handuk Lap Bayi Bentuk Kotak New KDE030,Washlap,,"Bayi,Kotak,New ",21541337,45,24
Waslap jari,Waslap ,,jari,62187412,45,12
Paket waterbeads,waterbeads,,,59013168,45,12
NEPPI Baby Wipes LAVBABY,Wipes,NEPPI ,Baby ,51018134,45,12
Wooden peg 3.5 cm / klip foto,Wooden peg,,3.5 cm,124116976,45,11