product_name,core_terms,brand,stop_words,itemid,main_cat,weekly_orders
Baby Moon walk Alat Bantu Jalan Anak Bayi / Baby Walker / baby moon walk, Baby Walker,,"Bayi,Baby ",53584308,45,19
CD / Celana dalam anak bahan libby allsize muat smp 18kg murah meriah 60rb/kodi, Celana dalam ,libby ,"anak,18kg,",117862148,45,17
1 pasang Sarung Tangan dan Sarung Kaki Libby Untuk Bayi 0-12 bulan (unisex), Sarung Tangan,Libby,"Kaki,unisex, 0-12 bulan",85126715,45,27
Alas Ompol Baby Oz 1/2 Lusin,Alas ,,"1/2 Lusin,Baby ",18225714,45,16
Alas Ompol Bayi / Alas Kain Lurik Pelangi / 45 x 50 cm Rainbow KDE037,Alas Ompol,,"Bayi,45 x 50 cm",21543404,45,32
Set Apron Menyusui dan Bantal Menyusui,Apron ,,Set ,64572088,45,34
AYUNAN & KELAMBU BABY SAJA TANPA PERBESIGETIGA ALAS,AYUNAN,,BABY,28383400,45,22
Mesin ayunan listrik bayi merk polar,ayunan ,polar,bayi,22057651,45,12
REVIEW TERBANYAK. Ayunan ayun listrik elektrik bayi mesin otomatis,Ayunan ,,bayi ,47628593,45,11
Baby Bag organizer 2in1 (bisa selempang & ransel) tas diaper botol susu bayi balita,Baby Bag,,"bayi,balita",87584172,45,11
"Promooo Andrea baby carrier, ergo carrier lokal original",baby carrier,Andrea ,,98433606,45,11
SEBAMED Baby Cream Extra Soft 200 ml / 200ml,Baby Cream,SEBAMED ,"200ml,Soft ",22099298,45,11
Baju Anak 4pcs @32.900 Setelan FootBall All Size 6 bulan - 2 tahun,Baju,,"Anak,4pcs,",169589641,45,24
1/2 Lusin Setelan Baju Panjang + Celana Panjang Kancing Sablon Warna,Baju,,"Lusin,Panjang,Warna",103860134,45,24
Baju Setelan Kemeja Anak Import | Kemeja Import Murah,Baju,,"Anak,Murah",131028529,45,24
4pcs@47.5 Babeebabyshop LITTLE EXECUTIVE ROMPER jumperbayi jumperanak jasanak jasbayi bajupestabayi,baju,Babeebabyshop ,4pcs,15037080,45,18
Baju Muslim Gamis Anak Perempuan Murah Simple Cantik - Peach,Baju,,"Anak,Perempuan,Cantik,Peach",131657945,45,16
Baju kostum Mermaid sisik baju renang,Baju,,,140543591,45,14
Baju Setelan Anak Import | Kaos Anak Fashion Lucu,Baju,,"Anak,Lucu",131012352,45,14
Baju Muslim Gamis Anak Perempuan Murah Simple Cantik - Peach,Baju,,"Anak,Perempuan,Simple,Peach",131657945,45,13
Baju mermaid trand murah kualitas bagus,Baju,,,149773797,45,13
Baju Muslim Gamis Anak Perempuan Murah Simple Cantik - Peach,Baju,,"Anak,Perempuan,Peach",131657945,45,12
Baju Setelan Anak Import | Baju Fashion Trendy Murah,Baju,,Anak ,131012754,45,12
Libby St Baju Pendek Rainbow,Baju,Libby,Pendek ,108692124,45,11
Pasang NAMA+NO PUNGGUNG di baju bola bayi balita (romper jumper dress setelan bayi ),baju ,,"bayi,balita",9769462,45,20
"SETELAN BAJU BAYI ANAK PEREMPUAN (harian, main, piyama, baju tidur)",BAJU ,,"ANAK,PEREMPUAN",126536297,45,20
Baju rok tutu anak lucu,Baju ,,"anak,lucu",101072578,45,20
Tunik Flower Kids / dress Flower Kids / baju anak / pakaian anak / grosir baju anak branded,baju ,,anak ,73133376,45,19
Baju Lengan Panjang 100% Cotton Pink Panda,Baju ,,"Lengan,Panjang,Pink,Panda",33200400,45,19
Baju mermaid / baju putri duyung / baju anak berenang putri duyung,Baju ,,"putri duyung,anak ",159722179,45,19
Baju Muslim Gamis Anak Perempuan Pink Lucu Simple & murah,Baju ,,"Anak,Perempuan,Pink,Lucu",42163759,45,19
Baju koko anak laki 3in1 premium design - Setelan muslim lengan pendek,Baju ,,"anak,laki,3in1,lengan,pendek",149496071,45,18
Jogger Old Navy / jogger denim / baju anak / pakaian anak / grosir baju anak branded,baju ,Old Navy,anak ,91684869,45,18
Baju Muslim Gamis Anak Perempuan Pink Lucu Simple & murah,Baju ,,"Anak,Perempuan,Pink,Lucu",42163759,45,17
set rompi jangkar dasi baju anak cowok baju bayi grosir,baju ,,"anak,cowok,bayi",65123562,45,16
Dress sabrina anak flower kids / dress anak / baju anak / pakaian anak / grosir baju anak branded,baju ,,anak ,63016915,45,16
Baju Anak 4pcs @32.900 Setelan Baby Pilot 6 bulan - 2 tahun All size Cewe Cowo,Baju ,,"Anak,4pcs,Cewe,Cowo",111874968,45,15
Baju Anak 4pcs @32.900 Setelan FootBall All Size 6 bulan - 2 tahun,Baju ,,4pcs,169589641,45,14
baju setelan bayi lengan panjang murah berkualitas,baju ,,"bayi,lengan,panjang",45625844,45,14
Baju Anak 4pcs @32.900 Setelan Baby Pilot 6 bulan - 2 tahun All size Cewe Cowo,Baju ,,"Anak,4pcs,Baby,Cewe,Cowo",111874968,45,14
set rompi jangkar dasi baju anak cowok baju bayi grosir,baju ,,"anak,cowok,bayi ",65123562,45,14
Overall Oshkosh / overall anak cewek / baju anak / pakaian anak / grosir baju anak branded,baju ,Oshkosh ,"anak,cewek ",96356082,45,14
Baju bayi Tangan Pendek,Baju ,,"bayi,Tangan,Pendek",107347671,45,14
Baby Jumper Bola / Baju Bola Bayi Cowo TURN BACK CRIME TBC INTERPOL POLICE,Baju ,,"Bayi,Cowo ",24187360,45,14
Baju Anak Ecer dan Grosir Piyama Doraemon Lgn Pjg Salur 1- 4 Tahun laki dan Perempuan,Baju ,,"Anak,laki,Perempuan,1- 4 Tahun",111935473,45,13
Baju Muslim Gamis Anak Perempuan Murah Simple Cantik - Peach,Baju ,,"Anak,Perempuan,Peach",131657945,45,13
Baju Setelan Anak Cowok/ Kaos fashion import anak laki-laki/ hijau,Baju ,,"Anak,Cowok, laki-laki,hijau",42015246,45,13
1/2 Lusin Setelan Baju Pendek + Celana Pendek Kancing Sablon Warna,Baju ,,"1/2 Lusin,Pendek ",103855297,45,13
Baju Setelan Anak Cowok/ Kaos fashion import anak laki-laki/ biru,Baju ,,"Anak,Cowok,laki-laki,biru",60601266,45,13
BAJU TANGAN PENDEK COTTON POLOS,BAJU ,,"TANGAN,PENDEK,COTTON,POLOS",20935352,45,12
SETENGAH LUSIN SETELAN BAJU BABY BAYI LENGAN PANJANG BUKA KAKI PREMIUM QUALITY SNI,BAJU ,,"KAKI,BABY,BAYI,LENGAN,PANJANG,PREMIUM ",4534365,45,12
Babeebabyshop BAJU KOKO ANAK NOAH baju koko bayi baju muslim NOAH,BAJU ,,,19314493,45,12
Baju mermaid/putri duyung bagus murah,Baju ,,"duyung,bagus ",139486067,45,12
"PROMO VELVET "" SEA LION "" Setelan Pendek Velvet Junior SML XL XXL Baju Bayi Piyama",Baju ,SEA LION,"Pendek,S,M,L,XL,XXL",29154092,45,11
Setelan Bayi 0-12 month / Baju Bayi Pakaian Bayi Kaos Bayi Setelan Baby Murah Celana Bayi,Baju ,,,68225998,45,11
Setelan Baju Panjang Garis,Baju ,,Panjang ,70521722,45,11
Baju Muslim Gamis Anak Perempuan Pink Lucu Simple & murah,Baju ,,"Anak,Perempuan,Pink,Lucu,Simple,murah",42163759,45,11
Setelan Baby London 1-2thn Baju Anak Murah Baju Tidur Anak All size,Baju Anak,,"Murah,London,Baby ",104412030,45,11
Baju muslim gamis anak,Baju anak,,,139596899,45,11
Baju Jas Setelan Anak Import,Baju Anak ,,,133549382,45,11
Baju Anak Ecer dan Grosir Piyama Doraemon Lgn Pjg Salur 1- 4 Tahun laki dan Perempuan,Baju Anak ,,"1- 4 Tahun,laki,Perempuan",111935473,45,11
Baju Bayi Tanpa Lengan Yukensi Bahan Cotton Newborn Baby Unisex KDE001,Baju Bayi ,,"Lengan,Baby, Unisex",19755912,45,28
Baju Bayi Lengan Pendek Bahan Cotton Newborn Baby 0-12m Unisex KDE002,Baju Bayi ,,"Lengan,Pendek,Baby, Unisex",19757041,45,25
Babeebabyshop BAJU KOKO ANAK NOAH baju koko bayi baju muslim NOAH,BAJU KOKO ,,bayi,19314493,45,24
Baju renang diving anak cowok laki-laki TK SD,Baju renang,,"anak,cowok,laki-laki",54209953,45,11
Paket Intime Baby Bath Tub Blue + Pompa Bestway 5 inch/ Bak Mandi Bayi,Bak Mandi,Intime,"Bayi,5 inch,Blue ",73582594,45,34
PAKET INTIME BABY BATH TUB BIRU + POMPA 5 INCH - BAK MANDI BAYI,BAK MANDI,INTIME ,"BIRU,5 INCH,BAYI",81093872,45,11
BUNCHEMS Magical Magic Ball - Mega Pack 400+ pcs - Thorn Ball Clusters,Ball,BUNCHEMS,,72394773,45,22
Ball Rattle with Handle,Ball ,,,22644796,45,15
Vicks Baby Balsam Made in c(NEW PACKAGING),Balsam ,Vicks ,"Germany,Baby ",7032373,45,11
"lovelygubuk bandana mahkota anak, bandana princess anak, bandana crown mewah anak",bandana,lovelygubuk ,anak,95117979,45,17
"lovelygubuk bandana korea anak, bandana kuping anak, bandana telinga kucing",bandana,lovelygubuk ,"korea,anak,kuping,",95114094,45,13
"lovelygubuk bandana korea anak, bandana kuping anak, bandana telinga kucing",bandana ,lovelygubuk ,"korea,anak,telinga kucing",95114094,45,13
Bando Tali Kepala Bayi Anak Perempuan Elastis Payet Kuntum Bunga Mawar Simpul Manik-Manik,Bando,,"Kepala,Bayi ,Anak ,Perempuan",76283199,45,21
Bando Tali Rambut Bayi Anak-Anak Kain Melar Pita Bunga Mutiara Berlian Buatan,Bando,,"Bayi,Anak-Anak",76283198,45,21
Bando kelinci polos headband bayi bandana anak,Bando,,"kelinci,polos,bayi,anak",63876371,45,19
Bando kelinci polkadot bandana bayi headband anak,Bando,,"kelinci,polkadot,bayi,anak",63874455,45,15
Bando Tali Kepala Bayi Anak Perempuan Elastis Payet Kuntum Bunga Mawar Simpul Manik-Manik,Bando,,"Kepala,Bayi,Anak,Perempuan",76283199,45,13
Bando Tali Kepala Bayi Anak Perempuan Elastis Payet Kuntum Bunga Mawar Simpul Manik-Manik,Bando ,,"Kepala,Bayi, Anak, Perempuan ",76283199,45,20
"lovelygubuk bando pita anak model korea, bandana polkadot anak",bando ,lovelygubuk,"anak ,korea",16882838,45,19
Bando Tali Rambut Bayi Anak-Anak Kain Melar Pita Bunga Mutiara Berlian Buatan,Bando ,,"Bayi, Anak-Anak",76283198,45,18
Bando Tali Kepala Bayi Anak Perempuan Elastis Payet Kuntum Bunga Mawar Simpul Manik-Manik,Bando ,,"Kepala,Bayi,Anak,Perempuan ",76283199,45,18
"lovelygubuk bando pita anak model korea, bandana polkadot anak",bando ,lovelygubuk,"korea,anak,polkadot",16882838,45,17
Bando kelinci polkadot bandana bayi headband anak,Bando ,,"kelinci,polkadot,anak ",63874455,45,17
Bando Tali Kepala Bayi Anak Perempuan Elastis Payet Kuntum Bunga Mawar Simpul Manik-Manik,Bando ,,"Kepala,Bayi,Anak,Perempuan ",76283199,45,17
Bando Tali Rambut Bayi Anak-Anak Kain Melar Pita Bunga Mutiara Berlian Buatan,Bando ,,"Bayi,anak",76283198,45,16
Bando Tali Kepala Bayi Anak Perempuan Elastis Payet Kuntum Bunga Mawar Simpul Manik-Manik,Bando ,,"Anak,Bayi,Perempuan ",76283199,45,15
Bando kelinci polos headband bayi bandana anak,Bando ,,"kelinci,polos,bayi,anak",63876371,45,12
Bando Tali Kepala Bayi Anak Perempuan Elastis Payet Kuntum Bunga Mawar Simpul Manik-Manik,Bando ,,"Kepala,Bayi,Anak,Perempuan",76283199,45,12
Bando Tali Rambut Bayi Anak-Anak Kain Melar Pita Bunga Mutiara Berlian Buatan,Bando ,,"Bayi,Anak",76283198,45,12
Bando bunga untuk bayi dan anak,Bando ,,"bayi,anak,dan",76456549,45,11
Bando kelinci polkadot bandana bayi headband anak,Bando ,,"kelinci,polkadot ,bayi,anak",63874455,45,11
"lovelygubuk bantal guling bayi, bantal sandar bayi, guling bayi dan anak, batal gajah anak",bantal,,"anak,gajah",46248557,45,84
"lovelygubuk bantal guling bayi, bantal sandar bayi, guling bayi dan anak, batal gajah anak",bantal,,"gajah,anak,bayi ",46248557,45,35
"lovelygubuk bantal guling bayi, bantal sandar bayi, guling bayi dan anak, batal gajah anak",bantal,,"gajah,anak,bayi ",46248557,45,35
"lovelygubuk bantal guling bayi, bantal sandar bayi, guling bayi dan anak, batal gajah anak",bantal,,"bayi,anak,gajah",46248557,45,25
"lovelygubuk bantal guling bayi, bantal sandar bayi, guling bayi dan anak, batal gajah anak",bantal,,"bayi,anak,gajah",46248557,45,14
"lovelygubuk bantal guling bayi, bantal sandar bayi, guling bayi dan anak, batal gajah anak",bantal ,,"bayi,anak,gajah ",46248557,45,32
"lovelygubuk bantal guling bayi, bantal sandar bayi, guling bayi dan anak, batal gajah anak",bantal ,lovelygubuk ,"bayi,anak,gajah",46248557,45,19
Olus Pillow / Bantal Kesehatan Bayi Anti Peyang / Bantal Olus,Bantal ,,Bayi,19339771,45,19
"lovelygubuk bantal guling bayi, bantal sandar bayi, guling bayi dan anak, batal gajah anak",bantal ,lovelygubuk ,"bayi,anak,gajah ",46248557,45,18
IKEA jattestor Bantal gajah,Bantal ,IKEA ,gajah,131425053,45,11
"lovelygubuk bantal guling bayi, bantal sandar bayi, guling bayi dan anak, batal gajah anak",bantal bayi,,"anak,gajah",46248557,45,58
"lovelygubuk bantal guling bayi, bantal sandar bayi, guling bayi dan anak, batal gajah anak",bantal bayi,BABA SLING,"gajah,anak",46248557,45,11
Olus Pillow / Bantal Kesehatan Bayi Anti Peyang / Bantal Olus,Bantal Bayi ,Olus ,,19339771,45,11
Baterai Mainan AA / A2,Baterai ,,"AA ,A2",101012598,45,16
Baby Bather Sugar Baby,Bather ,Sugar Baby,,15539261,45,11
Battery AA untuk kelengkapan pembelian mainan.,Battery ,,AA ,75995292,45,16
BOY Baby Bed Set Sarung Lepas Bedcover Selimut Bantal Crown Mahkota Guling Alas Tidur Matras Bayi,Bed Set,,"Bayi,baby",75988725,45,16
BOY Baby Bed Set Sarung Lepas Bedcover Selimut Bantal Crown Mahkota Guling Alas Tidur Matras Bayi,Bed Set,,"Baby,Bayi",75988725,45,15
BOY Baby Bed Set Sarung Lepas Bedcover Selimut Bantal Crown Mahkota Guling Alas Tidur Matras Bayi,Bed Set,,"BOY,bayi",75988725,45,14
BOY Baby Bed Set Sarung Lepas Bedcover Selimut Bantal Crown Mahkota Guling Alas Tidur Matras Bayi,Bed Set,,"Bayi,Baby",75988725,45,12
Pigeon Baby Powder Cake 45Gr Chamomile White - Bedak Wajah Bayi PR061201,Bedak,Pigeon ,"Baby,Bayi,Wajah",74764196,45,17
KAZEL MODERN BEDONG PLUS SWADDLE,BEDONG,KAZEL ,MODERN ,163967693,45,29
BEDONG RAINBOW SOFT 100 X 90,BEDONG,,"SOFT,RAINBOW ",77500215,45,28
1/2 Lusin Bedong Jumbo 100 x 90 Motif Gambar Random Isi 6 Pcs Katun Flanel,Bedong,,"Lusin,6 Pcs,Jumbo ",32694947,45,26
Bedong Mix 9,Bedong,,,135660702,45,15
CARTERS BEDONG 4IN1 MOTIF,BEDONG,CARTERS ,4IN1,158456938,45,15
1/2 Lusin Bedong / Bedong Panjang / Selimut 150 x 45 cm Katun Flanel,Bedong ,,"1/2 Lusin,150 x 45 cm",32694584,45,20
Bedong Jumbo 100 x 90 Motif Gambar Random Isi 12 Pcs Katun Flanel,Bedong ,,12 Pcs,27596895,45,19
Kain Bedong Bayi Libby (3pc),Bedong ,Libby,Bayi ,36879417,45,17
Bedong Instan Kaos Hoodie Sleting Motif Superhero,Bedong ,,,30601543,45,12
"BEDONG INSTAN KAOS HOODIE SLETING ANEKA MOTIF ( STAR, BALL, HELLO KITY )",BEDONG ,,,141893493,45,12
Blouse Santa Red BASIC,Blouse,,Red ,53285457,45,11
uno stacko / boardgame,boardgame,uno ,,44037088,45,37
Jumper Bayi Polos / Bodysuit Baby,Bodysuit ,,"Bayi, Baby",7486811,45,18
Bola mandi anak murah,Bola,,anak ,66205672,45,12
mesh squishy ball ninja bola squeeze anti stress anggur splat toy,bola ,mesh squishy,,93373089,45,14
Bola Duri Nyala,Bola ,,,120666216,45,12
Boneka Gajah | Boneka Empuk | Boneka Anak Kecil,Boneka,,"Anak,Kecil,  Gajah",101210391,45,57
"lovelygubuk boneka metoo, kelinci meeto, boneka anak kecil, boneka lucu original metoo angela",boneka,,"lucu,kelinci , anak ",106671595,45,46
"lovelygubuk boneka metoo, kelinci meeto, boneka anak kecil, boneka lucu original metoo angela",boneka,,"kelinci,anak,kecil,lucu ",106671595,45,28
Boneka Bibi Cewek Singing,Boneka ,,Cewek,62034805,45,42
"lovelygubuk boneka metoo, kelinci meeto, boneka anak kecil, boneka lucu original metoo angela",boneka ,,"lucu ,kelinci ,anak ",106671595,45,38
"lovelygubuk boneka metoo, kelinci meeto, boneka anak kecil, boneka lucu original metoo angela",boneka ,,"kelinci,anak ,kecil,lucu",106671595,45,24
"lovelygubuk boneka metoo, kelinci meeto, boneka anak kecil, metto kostum lucu",boneka ,lovelygubuk,"kelinci,anak,kecil,lucu",124640870,45,21
"lovelygubuk boneka metoo, kelinci meeto, boneka anak kecil, metto kostum lucu",boneka ,lovelygubuk ,"kelinci ,anak,kecil,lucu",124640870,45,20
sofa boneka odong odong,boneka ,,,73054662,45,19
Boneka Gajah | Boneka Empuk | Boneka Anak Kecil,Boneka ,,"Gajah,Empuk,Anak,Kecil",101210391,45,15
Boneka Isi Lembut Model Kelinci Mewah Lembut Hadiah Ulang Tahun untuk Anak Bayi,Boneka ,,"Kelinci,Anak, Bayi,Lembut ",76282643,45,14
Singer Baby Boneka dengan Dot Menyanyi 16 lagu 2 bahasa FREE BATERAI,Boneka ,,"Baby,dengan ",99169270,45,11
(PROMO) Boneka Bibi Cewek Singing / Baby Singer,Boneka ,,"Cewek,Baby ",96236939,45,11
BKA TUTUP BIRU / Botol Kaca Asi Baru FREE BUBBLE WRAP LAVBABY,Botol,,Kaca,59032837,45,15
Botol Termos Korea Stainless Karakter Hewan Lucu / Cute Vacuum Flask Animal Character 500ml,Botol,,"Korea,Lucu,Cute,500ml",153947123,45,14
BKA Botol ASI Kaca Vial,Botol ,,,43182580,45,32
BOTOL ASI ISI 10 BOTOL KACA ASI BKA MOMOGI,BOTOL ,,,29539481,45,23
Botol Termos Korea Stainless Karakter Hewan Lucu / Cute Vacuum Flask Animal Character 500ml,Botol ,,"Korea,Lucu,Cute,500ml",153947123,45,19
Botol Termos Korea Stainless Karakter Hewan Lucu / Cute Vacuum Flask Animal Character 500ml,Botol ,,"Korea,Lucu,Cute,500ml",153947123,45,15
Botol Termos Korea Stainless Karakter Hewan Lucu / Cute Vacuum Flask Animal Character 500ml,Botol ,,"Korea,Lucu,Cute,500ml",153947123,45,13
Avent Natural 260ml Elephant bottle botol susu LAVBABY,botol ,Avent Natural,260ml ,14611616,45,12
Botol Termos Stainless Karakter Hewan Lucu / Cute Vacuum Flask Animal Character 500ml,Botol ,,"Lucu,Cute,500ml",153943516,45,12
Botol Termos Stainless Karakter Hewan Lucu / Cute Vacuum Flask Animal Character 500ml,Botol ,,"Lucu,Cute,500ml",153943516,45,12
Botol Kaca ASI BKA,Botol ,,,34869684,45,12
Pigeon Petite Straw Botol - Cangkir Minum Anak (3 Pilihan Wa,Botol ,Pigeon ,Anak ,50368716,45,11
PROMO DISC 15rb Botol Susu Philips Avent Classic Feeding Bottle 125ml,Botol Susu,Philips Avent,125ml,75627816,45,11
"korea,anak,kuping,kucing",bouncer,Sugar Baby,10 in 1,38622779,45,21
"Anak,Size S",bouncer,Sugar Baby,10 in 1,38622779,45,13
JBS ECO Sugar Baby Infant Seat Bouncer,Bouncer,Sugar Baby,Infant,14005366,45,12
*SALE* Pigeon Honeycomb Breast Pad / Breastpad Isi 66 / 66pcs,Breast Pad,Pigeon ,66pcs,72650898,45,15
Tokobabyshop Avent Washable Breast Pad With Laundry Bag (Isi 6) (Penahan Asi),Breast Pad,Avent,,32892587,45,12
Claire's Electric Breast Pump / Pompa ASI Elektrik GBP B20,Breast Pump,Claire's,,61173908,45,102
(New Design Lapis Dus) PIGEON Manual Breast Pump Breastpump Pompa Asi,Breast Pump,PIGEON,,103500264,45,39
IQ Baby Manual Breast Pump Pompa ASI Manual Butterfly 900,Breast Pump,IQ Baby,Butterfly,15430879,45,33
PROMO: Dr. Gym Electric Breast Pump/ Breastpump/ Pompa Asi Elektrik,Breast Pump,,,120284163,45,23
Claire's Electric Breast Pump Pompa Asi Elektrik,Breast Pump,Claire's ,,16334112,45,18
MOOI MOM SILICONE BREAST PUMP FREE LID,BREAST PUMP,,,104690434,45,16
Claire's Electric Breast Pump / Pompa ASI Elektrik GBP A30,Breast Pump,Claire's Electric,,117871466,45,13
(New Design Lapis Dus) PIGEON Manual Breast Pump Breastpump Pompa Asi,Breast Pump,PIGEON ,,103500264,45,11
Gabag Breastpad isi 60 disposable LAVBABY,Breastpad ,Gabag ,,122729690,45,17
Dacco Mama Pad Breastpad 56 Pcs,Breastpad ,Dacco Mama,56 Pcs,124368742,45,13
Pompa asi / Breastpump IQ BABY MANUAL IQ899,Breastpump, IQ BABY,,5294778,45,17
Breastpump Spectra 9 plus 9plus Double pump / pompa asi Spectra 9 + LAVBABY,Breastpump,,,14021744,45,15
Spectra Valve Silicone Head Sparepart Pompa Asi / Breastpump ORIGINAL ASLI,Breastpump,,,101250510,45,12
NAYZ ORGANIK (bebiluck) bubur bayi sehat,bubur ,NAYZ ORGANIK,bayi ,143905025,45,14
"#BukuEmosi (reject, bahasa Indonesia)",Buku,,,161490345,45,14
soft book / cbantal mengenal alif sampai ya hijaiyah,buku,,,8261389,45,14
Buku bantal seri islam dan balita,Buku ,,balita,82563644,45,13
Buku + Wayang Cilukba!,Buku ,,,75913519,45,12
Elle & vire unsalted butter 10*10gr / butter plain untuk MPASI bayi,butter,Elle & vire,"10gr,bayi",127325591,45,22
Elle & Vire unsalted salted butter mentega tawar mpasi bayi baby,butter,Elle & Vire,"bayi,baby",74910511,45,15
(Sudah Packing Kardus) My Yummy Bites 50gr MURAH EXPIRED masi LAMA CAMILAN BAYI,CAMILAN,My Yummy Bites,"50gr,BAYI",90981140,45,24
Kiddy baby car seat/Car Seat Portable/carseat bayi/car seat baby,Car Seat,Kiddy ,baby,60745742,45,11
FLASH CARD Dunia Binatang Seri 1,CARD ,,Binatang ,96560587,45,13
Cd anak bahan libby,Cd ,libby,anak ,121021999,45,11
Celana santai mix size harga 1 kodi,Celana,,kodi,77743736,45,31
Celana biggie,Celana,,,96012313,45,15
Celana Anak Ecer dan Grosir Jogger Semi Denim Strech 1- 6 Tahun Cewek Cowok,Celana,,"Anak,1- 6 Tahun,Cewek,Cowok",111975981,45,13
Celana santai anak size s kodian,Celana ,,"anak ,S,kodian",15351904,45,31
Celana Panjang 100% Cotton Pink Panda,Celana ,,"Pink,Panda,Panjang ",33201413,45,23
Setelan Newborn Tangan Panjang Libby (Celana Panjang & Tangan Panjang),Celana ,Libby,"Tangan,Panjang",58019149,45,18
Celana Panjang Anak Chino 0-6bln - 1-4 tahun,Celana ,,"Anak, 0-6bln - 1-4 tahun",48007101,45,17
Celana Kulot Anak (KHUSUS YANG SUDAH PO),Celana ,,Anak ,118053193,45,15
Jegging (Celana Panjang) Bayi Size 2 (7-18 bulan),Celana ,,Bayi ,31715592,45,15
celana panjang bayi murah berkualitas,celana ,,"panjang,bayi",58609059,45,15
BLOOMY PANTS CELANA ANAK MOTIF,CELANA ,,ANAK ,61722433,45,14
Celana Pendek / Hot Pants Anak Laki-laki bahan Jeans warna Biru Tua - BS01B,Celana ,,"Anak,Laki-laki,Biru Tua",89471088,45,13
Celana Panjang kaki Terbuka,Celana ,,"Panjang,kaki",107353167,45,13
READY celana biggie anak 12pc,celana ,,"anak,12pc",108214035,45,13
Celana Kacamata Bayi / Celana Pop / Warna Motif Sablon Bahan PE KDE036,Celana ,,Bayi ,19755740,45,13
Celana Anak Ecer dan Grosir Jogger Semi Denim Strech 1- 6 Tahun Cewek Cowok,Celana ,,"1- 6 Tahun,Cewek,Cowok,Anak",111975981,45,12
Celana petak Bayi,Celana ,,Bayi,102248577,45,11
Ecer / Size S M L / Celana Pendek Army / Katun Twill / Celana Pendek / Celana Anak,Celana Army,,"S,M,L,Pendek,Anak",73942949,45,11
Celana Chino Oshkosh / celana panjang / baju anak / pakaian anak / grosir baju anak branded,Celana Chino ,Oshkosh,"anak,panjang ",76013430,45,24
Celana Chinos denim oshkosh / cinnos denim / chinno denim / celana anak / grosir baju anak branded0,Celana Chinos,oshkosh ,anak ,74452000,45,11
CELANA DALAM ANAK CEWEK (B0NITA),CELANA DALAM,,"ANAK,CEWEK ",86045686,45,21
KONVEKSI Jogger Celana Anak,Celana Jogger ,,Anak,123865303,45,35
Jogger Bayi uk 3-18 Month / Jogger Pants Celana Jogger Joger Bayi Celana Bayi Celana Panjang Bayi,Celana Jogger ,,"Bayi,Panjang,3-18 Month",63028161,45,22
Celana Kacamata Bayi / Celana Pop / Putih Motif Warna Bahan TC Cotton,Celana Kacamata ,,"Bayi ,Putih ",27600534,45,23
Hot Pants Celana Pendek Anak,Celana Pendek,,Anak ,156856259,45,11
Celana Pendek / Hot Pants Anak Laki-laki bahan Jeans warna Biru Muda - BS01A,Celana Pendek ,,"Anak,Biru ",80359223,45,34
Celana Pendek / Hot Pants Anak Laki-laki bahan Jeans warna Biru Muda - BS01A,Celana Pendek ,,"Anak, Biru, Laki-laki",80359223,45,31
Celana Pendek Bayi / Celana Bayi Putih Sablon / Unisex Bahan PE KDE023,Celana Pendek ,,"Bayi,Putih,Unisex ",19758518,45,31
Celana Pendek Bayi / Celana Bayi Warna Bordir / Unisex Bahan PE,Celana Pendek ,,"Bayi ,Warna ,Unisex ",171390702,45,11
Celemek Segitiga Carter,Celemek,Carter,Segitiga ,134460758,45,34
Celemek Segitiga Carter,Celemek ,Carter,Segitiga ,134460758,45,12
Celengan ATM Mini Karakter,Celengan,,Mini,19063966,45,14
Celengan ATM Mini Karakter,Celengan,,Mini ,19063966,45,12
Celengan ATM Mini Karakter,Celengan ,,Mini ,19064459,45,17
Celengan anak karakter,Celengan ,,anak ,82386714,45,14
Celengan anak karakter,Celengan ,,anak ,82386714,45,11
Yummy bites 123 cemilan bayi sehat,cemilan bayi,Yummy bites,,121109192,45,11
Gerber cereal,cereal,Gerber ,,15430018,45,12
Baby Soes Cheese,Cheese,,,67067533,45,13
chil kid vanilla 1600 gram,chil kid,,1600 gram,56598982,45,12
"SLEEK Baby Bottle, Nipple, And Accessories Cleanser / Sabun Cuci Pencuci Botol Refill 900 ML / 900ml",Cleanser ,SLEEK ,900 ML,143705895,45,13
Sleek Bottle cleanser 450ml (pencuci botol dll),cleanser ,Sleek ,450ml ,143484408,45,11
"lovelygubuk pengaman colokan listrik, pengaman listrik motif beruang",colokan,,beruang,93119394,45,14
Ladang Lima Blackmond Cookies - Gluten Free,Cookies,,,75981435,45,12
Telon Bebe Roosie cream,cream,Bebe Roosie,,16452310,45,15
"Sudocrem Sudocream Mother Baby Care Healing Cream Ruam Popok, Luka, Eksim, Jerawat made in UK",Cream ,Sudocream ,Baby ,46079438,45,17
SEBAMED Baby Protective Facial Cream 50 ml / 50ml,Cream ,SEBAMED ,"Baby,Protective,Facial,50ml",97513927,45,13
Sudocrem Baby Care Cream Sudocream Krim Bayi Serbaguna 125gr 125 gr,Cream ,Sudocrem ,"Bayi,125gr",126617211,45,12
DASTER LENGAN SIZE M 1-3THN,DASTER,,"1-3THN,LENGAN,SIZE M",12830869,45,29
DASTER LENGAN SIZE L 4-5THN,DASTER,,"LENGAN, SIZE L, 4-5THN",12830900,45,21
Daster Yukensi Bayi uk 0-12 month / Dress Bayi Baju Bayi Kaos Daster Edo Meylan Grosir,Daster,,Bayi,71644903,45,14
DASTER YUKENSI BRAND DINDA SIZE M 1-3THN,DASTER ,,1-3THN,8829029,45,17
Grosir DASTER LENGAN,DASTER ,,LENGAN,48646844,45,17
Grosir DASTER LENGAN,DASTER ,,LENGAN,48646844,45,16
Daster Yukensi uk 1-2th // Dress Balita Dress Anak Cewek Dress Yukensi Murah Daster Edo Meylan,Daster ,,"1-2th,Anak,Cewek,Balita ",69688379,45,13
Daster Yukensi uk 3-5 th // Dress Balita Dress Anak Cewek Dress Yukensi Dress Daster Edo Meylan,Daster ,,3-5 th,8221495,45,12
Clodi babyland 2 insert mikrofiber / clodi babyland / clodi grosir / cloth diapers / clodi murah,diapers,,mikrofiber,19033805,45,22
Clodi babyland 2 insert mikrofiber / clodi babyland / clodi grosir / cloth diapers / clodi murah,diapers,babyland,,19033805,45,21
Clodi babyland 2 insert mikrofiber / clodi babyland / clodi grosir / cloth diapers / clodi murah,diapers ,babyland ,,19033805,45,16
KHAY LONG DRESS GAMIS ANAK 1-5TH,DRESS,,"ANAK ,1-5TH",33683216,45,21
QUINSHE LONGDRESS GAMIS ANAK 6-12TH,DRESS,,"ANAK,6-12TH",130656088,45,15
DRESS LENGAN SHILA COLLECTION SIZE M 2-3TH N,DRESS,,"LENGAN,SIZE M,2-3TH",18177647,45,15
gamis anak / dress anak,dress,,anak,147647327,45,13
Dress anak,Dress,,,112672868,45,11
GROSIR Dress Baby Jumping Beans,Dress ,,Baby ,36346489,45,17
OSHKOSH DRESS JEANS,DRESS ,OSHKOSH ,,173525542,45,16
Dress payung,Dress ,,,90407290,45,15
DRESS SHICO SIZE M 2-3THN,DRESS ,,"SIZE M,2-3THN",57195398,45,14
Long dress Flower Kids / baju anak / pakaian anak / terusan anak cewek / grosir baju anak branded,dress ,,"anak,cewek",96338979,45,12
Shan dress kid 5 warna / Dress anak perempuan / shansan / shanshan / ribbon,dress ,,"anak,perempuan",98291179,45,12
gamis anak / dress anak,dress ,,anak,147647327,45,11
(6-12th) Gamis/ Long Dress kaos anak ( QuinShe longdress - anak SD ),Dress ,QuinShe ,anak ,132546982,45,11
Dress Alona uk 3 th // Dress Balita Dress Anak Cewek Dress Import Dress Yukensi Dress Murah,Dress Balita ,,"Anak,Cewek,3 th,Murah",60121541,45,12
"lovelygubuk pembersih kuping LED motif, Ear pick",Ear pick,lovelygubuk ,kuping,13970064,45,21
"lovelygubuk pembersih kuping LED motif, Ear pick",Ear pick,lovelygubuk ,,13970064,45,16
"lovelygubuk pembersih kuping LED motif, Ear pick",Ear pick,lovelygubuk ,,13970064,45,16
"lovelygubuk pembersih kuping LED motif, Ear pick",Ear pick,,kuping ,13970064,45,12
EARPICK LED - FLASHLIGHT EARPICK -EAR PICK / KOREK KUPING LED,EARPICK,,KUPING ,69910052,45,37
Pembersih Telinga Newest Flashlight Earpick,Earpick,,Telinga ,87554835,45,24
