product_name,core_terms,brands
Kogan Action Camera / Sport Camera HD DV 12MP 1080p Water Ressistant,camera,
Xiaomi Yi Baterai/Battery Replacement,"baterai, battery",
Fujifilm Refill Instax Mini Film Twinpack Plain - 20 Lembar,,
[BONUS] Refill Instax Polaroid Fujifilm Twinpack Plain (20 lembar),,
Xiaomi Yi Action Camera - 16 MP - International Edition- Hitam/Putih/Hijau,camera,xiaomi
Xiaomi Yi Silicone Case and Lens Cap - Hitam,"case, lens cap",
"Anti Fog (Embun) Drying Filter 12pcs for GoPro, Xiaomi Yi & SJ4000","filter, anti fog embun, gopro xiaomi",
Kogan Action Camera / Sport Camera HD DV 12 MP 1080p Water Resistant Import,camera,
Fish Eye,,
Free Ongkir !! Xiaomi Yi Action Cam-16MP- Hitam+Sandisk 16GB+Waterproof Case+Monopod,case,
"Tripod Takara Eco-193A + Pouch / tas U/ Gopro, Sj4000, Sj5000, Xiaomi Yi, takara 193a","tripod, pouch, tas, gopro xiaomi yi",
3-Way Grip-Arm-Tripod for SJCAM SJ4000/SJ5000 & GOPRO 4/3+/3 XIAOMI YI,"tripod, sjcam gopro xiaomi",
"Action Cam Small Size Bag/Tas/Case for SJCAM,XIAOMI YI & GOPRO HERO","case, tas",
PROMO 12mp Sport Action Camera 1080p - hitam dan silver + Bonus Banyak LIKE KOGAN GO PRO XIAOMI,"camera, banyak, kogan go pro",xiaomi
Xiaomi Yi Dual/Double Desktop Baterai/Battery Charger,"baterai, battery, charger",xiaomi
Xiaomi Yi Paket Lengkap Garansi 1 Tahun,,
"Action Cam Bobber Floating Hand Grip for SJ4000,SJ5000,M10 / GoPro",cam bobber,
Kogan Action Camera+WIFI / Sport SJCAM Camera HD-DV 12MP 1080p Waterproof,camera,
Smoke Bomb besar / Pipa Asap / Supporter Smoke 60 detik,"bomb besar pipa, supporter",
Tripod 1 Meter 3110 Provesional Hp Kamera Gopro Multifungsi,tripod,
"Camera Battery Case Storage Box for Xiaomi Yi, Gopro, Brica & Sjcam",case,
Cetak Foto Polaroid,cetak,
"Tongsis Attanta SMP-07 - Hitam (GoPro,SJCAM,XiaomiYi,DSLR,Smartphone)","tongsis, smartphone",
Xiaomi Yi Paket Hemat Lengkap Bergaransi,,
"Tripod takara 193A + tas for dslr,xiaomi yi,bpro,gopro,sjcam","tripod, tas",
"\"Sport Action Camera WiFi | FULL HD-DV 1080P H.264 | 2.0\"\" LCD\"","camera, lcd, hd dv h",
Xiaomi Yi Complete Set Baterai/Battery Charger,"baterai, battery, charger, xiaomi yi",xiaomi
Kogan Action Camera NV- 1080p - 12mp - 2.0 inch - Wifi - Putih,camera,
KingMa Original Housing Waterproof Case for Xiaomi Yi Action Camera - Hitam,"case, kingma",
Xiaomi Yi Silicone Case and Lens Cap - Biru,"case, lens cap",
Cleaning Kit 9 In 1 With Lenspen - Pembersih Kamera,"pembersih, kit",
E-128 Handheld Stabilizer Untuk Kamera Digital - Merah + Silver + Hitam,,
Action Camera / Sport Camera HD DV 12MP 1080p Water Ressistant,camera,
[ FREE ONGKIR ] TRIPOD KAMERA DSLR tinggi 1 meter + holder U buat hp,"tripod, holder",
"Action Cam Medium Size Bag/Tas/Case for SJCAM,XIAOMI YI & GOPRO HERO","case, tas",
Paket Hemat Xiaomi Yi Camera Black Hitam International Action Camera Internasional,camera,xiaomi
"Bcare BCam X-3 Action Camera WiF 16 MP SonySensor 4K - Layar 2\"\"","camera, mp sonysensor",
Silicone Case For Canon EOS M-10 - Hitam,"case, canon eos m, silicone",
Leather Case Kamera Fujifilm X-M1/X-A2 (Coklat),"leather, case",
Action Cam / Go Pro No Wifi / Wi fi full HD 1080p,"cam, pro, wi",
Kogan Action Camera 4k Ultrahd - 16mp - Putih - Wifi,camera,
Bcare Water Proof Anti Blur Case IPX68 40m For Xiaomi Yi Sports Camera,"case, bcare water, xiaomi yi sports, anti blur",
Action Camera+WIFI/Sport SJCAM Camera HD-DV 12MP 1080 Waterproof,camera,
Xiaomi Yi Action Camera - 16 MP - International Edition- Hitam/Putih/Hijau,camera,xiaomi
sports Camera 4K Ultra HD DV Wifi /Pc/ Bh,"camera, ultra hd, pc",
"Monopod Tongsis For Action Camera (Xiaomi Yi, Kogan, Etc)","tongsis, camera",xiaomi
Leather Case For Canon Eos M10 Kit 15-45mm - Brown,"case, canon eos kit, leather",
Promo Spider Flexible Tripod Mini Terlaris,tripod,
"Action Cam Tripod Adapter Mount for SJ4000,SJ5000,M10 / GoPro AGP61000",tripod,
Leather Case For Canon Eos M3 Kit 15-45mm - Brown,"case, canon eos kit, leather",
Sport Action Camera 4K 16MP Ultra HD like gopro xiaomi kogan,"camera, gopro xiaomi",xiaomi
"Tongsis Titanium Attanta SMP-08 Warna Hitam for GoPro,Xiaomi Yi & HP.","tongsis, gopro xiaomi yi",
"\"Kamera Camcorder Digital TFT LCD HD 720P 18MP Ukuran 2.7\"\" dengan 8x Perbesaran\"",lcd,
Tempered Glass / Screen Protector For Sony A5000/5100/6000,"tempered, glass",
"Tas Kamera Mirrorless & Prosummer S-10 Hitam For Canon, Nikon, Sony, Fujifilm","tas, canon nikon sony",
Mini Photo Studio Simple Photo Box Lipat Portable LED Lamp,"box, led, lamp, mini",
Xiaomi Yi Silicone Case and Lens Cap - Merah,"case, lens cap",
Leather Case For Canon Eos M10 Kit 15-45mm - Hitam,"case, canon eos kit, leather",
Xiaomi Yi WaterProof Case (Housing Underwater),case,
BRICA B-PRO 5 Alpha Edition Warna Silver Combo Supreme HD 1080p Wifi,combo supreme hd,
Hot: Perekam Video Digital Full HD 1080P 16MP DV DVR 2.7'' TFT LCD 16 x Zoom|V116,"lcd, perekam, digital, hd, zoom",
Paket Hemat Xiaomi Yi Camera Black Hitam International Action Camera Internasional,camera,xiaomi
"Tripod Takara ECO-173A+HolderU+ Adapter+Pouch untuk Handphone, GoPro, Xiaomi YI, Bpro, Kogan","tripod, pouch, handphone",
Silicone Case For Canon Eos M3,"case, canon, silicone",
Silicone Case For Canon EOS M-10 - Pink,"case, canon eos m, silicone",
Tripod WEIFENG WT-3110A Profesional,tripod,weifeng
Multi Power Grip Battery Holder For Nikon EOS D3100 D3200 D3300 DSLR Camera,"battery, holder, camera, nikon eos dslr",
Spy Camera Pen / Pena Kamera Pengintai Spycam,"camera, pen",
Xiaomi Yi Kingma Waterproof Back Door Lock Clip Replacement,door lock clip,
Handheld Video Camera Stabilizer for DSLR GoPro Xiaomi Yi Hitam,camera,xiaomi
Spy Camera | Spycam | Spy Cam Kacamata HD High Quality / Glasses Camera Kualitas HD,"kacamata, kualitas, spycam, spy camera",
KingMa Original Housing Waterproof Case Versi 3 - 2017 for Xiaomi Yi Action Camera - Hitam,"case, kingma, versi",
Silicone Case For Sony Alpha Mirrorless A5000/A5100,"case, sony alpha, silicone",
Photo Studio Box + Lampu LED untuk keperluan Foto Produk Online Shop,"lampu, produk online",
"\"Action Camera | Sports HD-DV 1080P H.264 | Full HD 2.0\"\" LCD SCREEN\"","camera, lcd",
Gorilla Pod + Holder Universal / Tripod Gorillapod Flexible Tripod,"holder, tripod, gorilla pod",
"Tripod Takara Eco-193A + Pouch/tas U/ Kamera DSLR, Action Cam Gopro, SJCam, Xiaomi Yi , BPro, Kogan","tripod, pouch, tas",
Xiaomi Yi CPL (Circular Polarizing) Filter Lens 37mm + Lens Cap,lens,
"Mini Tripod Mount Adapter for Action Camera GoPro, BRICA, Xiaomi Yi","tripod, camera",xiaomi
Action sport Camera 4K Ultra Hd Wifi,"camera, ultra hd",
Free tongsis! Kamera gopro kogan 16 MP non wifi sjcam,tongsis,
[BONUS] Refill Instax Polaroid Fujifilm Twinpack Plain (20 lembar),,
Leather Case For Fujifilm X-A3 - Hitam,"case, fujifilm x, leather",
Sil DFS,sil,
Xiaomi Yi Action Camera Basic Internasional FREE Tripod Mount Adapter - International Edition,"camera, tripod",xiaomi
Hot: Perekam Video Digital Full HD 1080P 16MP DV DVR 2.7'' TFT LCD 16 x Zoom|V116,"lcd, perekam, digital, hd, zoom",
TAS KAMERA DSLR CANON GEAR BLACK | Ransel,tas,
Side Frame Case for Xiaomi Yi Action Camera,"case, xiaomi yi action",
Tempered Glass / Screen Protector / Anti Gores LCD For Fujifilm X-A3,"tempered, glass, lcd, anti gores, fujifilm",
Leather Case For Fujifilm X-A3 - Coklat/Brown,"case, fujifilm x coklat, leather",
Paket Gopro KOMPLIT 1bh Kamera Sportcam Wifi 4 K /16 Mp Dan 1 Bh Tongsis Yunteng,tongsis,yunteng
"\"Sports Action Camera WiFi 4K | ULTRA-HD 16MP | 2\"\" LCD | Waterproof DVR\"","camera, lcd, ultra hd",
"Floating Hand Grip Bobber For Go Pro, Sj Cam, Brica And Xiaomi Yi Murah","xiaomi yi, bobber",
Silicon Case and Lens Cap for Xiaomi Yi Action Camera (Yi 1/ Basic),"case, lens cap",
Action Camera+WIFI/Sport SJCAM Camera HD-DV 12MP 1080 Waterproof,camera,
Silica Gel blue kemasan sachet 2gram,"kemasan, silica gel",
"\"Bcare BCam X-3 16 MPSonySensor 4K-2\"\"-Hitam+Micro SD 16GB C10+Tongsis\"",tongsis,
Xiaomi Yi Paket Lengkap Garansi 1 Tahun,,
"Selfie Stick 3in1 ( Tongsis, Tripod, Tomsis )","tongsis, tripod",
Free Ongkir - Mini Studio Photo Box Portable Lipat + Lampu LED Lamp,lampu led,
Jam Since 21 Tali 2 jam / Jam Set 21 ring 21 Tali ||| 22222222222222 FREE BATERAI CADANGAN,"jam, ring, baterai, tali",
Box SKmei / Pembelian Dengan Jam Tangan / With Watch / skmei / skmei casio,"box, jam, watch, skmei skmei",
MAU TAU CARA TAMBAHAN SUBSIDI ONGKIR MINIMAL BELANJA 120 RIBU FREE ONGKIR 30 RBU ?,ongkir,
MAU TAU CARA TAMBAHAN SUBSIDI ONGKIR MINIMAL BELANJA 120 RIBU FREE ONGKIR 30 RBU ?,ongkir,
harga grosir 2016 jam tangan pria stainlees fashion berbentuk bulat bersinar,jam,
Jam Tangan Vogue Pria Wanita Stainless Steel Quartz Olahraga Dress Gelangan Kulit,"jam, dress",
Jam Tangan GC Guess Collection Chrono Kulit Merah *RG || MERAH* # GC001 #,jam,
Jam Quicksilver Tanggal Hari Coklat Tua ## QS001 ##,jam,
Jam Tangan Analog Quartz Fashion Mewah Wanita Cewek,jam,
Jam Tangan Gelang Wanita Vogue Quartz Analog Tali Ultra Tipis,"jam, gelang",
Jam Since 2 Jam 21 Tali box kado REAL PHOTO MillieMinnie/ Jam Tangan Wanita Fashion Fancy,"jam, box, kado",
Jam Tangan Gelang Wanita Vogue Quartz Analog Tali Ultra Tipis,"jam, gelang",
Jam Tangan GC Guess Collection Chrono Variasi Kulit Hitam *RG || HITAM* # GC001 #,jam,
Jam Quicksilver Tanggal Hari Hitam ## QS001 ##,jam,
Jam Tangan Pria / SKMEI Casio Men / Digital LED + Analog / AD 1016,"jam, led, analog",
Braid Leather Watch (Jam Etnik/Lilit/Tribal/Indian),"leather, watch, jam",
Smartwatch Jam Tangan HP Bluetooth Pasangan Android&IOS Iphone Samsung LG,"smartwatch, jam, iphone",
Braid Leather Watch (Jam Etnik/Lilit/Tribal/Indian),"leather, watch, jam",
Braid Leather Watch (Jam Etnik/Lilit/Tribal/Indian),"leather, watch, jam",
Jam Tangan Vogue Pria Wanita Stainless Steel Quartz Olahraga Dress Gelangan Kulit,"jam, dress",
Jam Tangan Ripcurl Detroit Black ** HITAM ** # RP001 #,jam,
Jam Tangan GC Guess Collection Chrono Kulit Coklat *RG || COKLAT* # GC001 #,jam,
Jam CHANEL Couple,jam,
Smart Watch Bluetooth HP Kamera untuk Android&IOS Iphone Samsung LG HTC,"watch, iphone",
BOX MIKA HITAM POLOS,"box, mika",
Jam Tangan Pria Quiksilver Hari+Tanggal,jam,
JAM TANGAN GUESS NEW 3IN1,"jam, tangan",
Jam Tangan Pria / SKMEI ORIGINAL / SKMEI 1171 / Casio / Seiko / SKMEI,"jam, skmei casio seiko",
Jam Tangan Wanita / Exclusive Design / Skmei 1085,jam,
Jam Tangan Guess paket set 3in1 / Jam tangan wanita murah,jam,
Jam Tangan Quartz Bulat Gelang Kulit PU,"jam, gelang",
SMART WATCH DZ09/U9 SUPPORT SIM CARD & MEMORY CARD & CAMERA,"watch, card, camera, sim",
Jam Tangan Couple RO - LEX Kulit Hitam Plat Hitam **HPH** # RX001 #,jam,
BATERAI SONY 626 LR626,baterai,
Jam Tangan Pria / SKMEI Casio Men / Digital LED + Analog / AD 1016,"jam, led, analog",
harga grosir jam tangan pria bahan kulit model simpel vintage terlaris 2016,jam,
Jam Tangan Quartz Bulat Gelang Kulit PU,"jam, gelang",
JAM TANGAN GENEVA CHRONO VARIASI LEATHER ************ PUTIH #GN004#,"jam, leather",
Jam Tangan Pria / SKMEI ORIGINAL / SKMEI 1135 / Seiko SKMEI / Casio,"jam, skmei seiko skmei",
Jam Tangan Couple Tali Kulit ** COKLAT MUDA ** # RX001 #,"jam, tali kulit coklat",
Jam Tangan Analog Quartz Fashion Mewah Wanita Cewek,jam,
Braid Leather Watch (Jam Etnik/Lilit/Tribal/Indian),"leather, watch, jam",
Jam Tangan Analog Quartz Fashion Mewah Wanita Cewek,jam,
Jam tangan wanita digital,jam,
Jam Tangan Unisex New Arrival Warna-Warni Dial Digital Bisa Dipindah Tali Kulit Imitasi,"jam, warna warni",
JAM RANTAI CUSTOME,"jam, rantai",
Jam Tangan GC Guess Collection Chrono Kulit BIRUTUA *RG || * BIRUTUA #GC001#,jam,
Jam Tangan LED Layar Sentuh Untuk Pria dan Wanita,"jam, led",
"\"Jam Tangan Quicksilver \"\"Chrono Variasi\"\" Couple\"",jam,
TERMURAH !!! Jam Tangan Since dgn 2 Jam 21 Tali dan 21 Ring,"jam, ring",
Jam Tangan Wanita Analog Quartz Vogue Bertabur Berlian Buatan dengan Tali Kulit Cocok untuk Kadoi,jam,
Jam Tangan Pria / SKMEI ORIGINAL / SKMEI 1206 / Casio SKMEI / Sunnto,"jam, skmei casio skmei",
Jam Quartz Wanita Kasual Berlian Imitasi Multilayer Liontin Bulat Tali Tipis,"jam, liontin",
Jam Tangan iwatch U10 Smart Watch Touch Screen + GSM,"jam, watch, screen",
Jam Tangan iwatch U10 Smart Watch Touch Screen + GSM,"jam, watch, screen",
Jam Tangan Wanita Bulan Bintang Menawan Berlian Palsu Warna-Warni Gelang Kulit Imitasi,"jam, gelang",
Jam Tangan iwatch U10 Smart Watch Touch Screen + GSM,"jam, watch, screen",
Braid Leather Watch (Jam Etnik/Lilit/Tribal/Indian),"leather, watch, jam",
harga grosir jam tangan pria bahan kulit model simpel vintage terlaris 2016,jam,
Jam since 2 jam 21 tali + box kado,"jam, box",
Jam Quartz Wanita Kasual Berlian Imitasi Multilayer Liontin Bulat Tali Tipis,"jam, liontin",
Jam Tangan Pria / SKMEI ORIGINAL / SKMEI 1142 / Casio SKMEI,"jam, skmei casio",
Jam Tangan Pria / SKMEI ORIGINAL / SKMEI 1135 / Seiko SKMEI / Casio,"jam, skmei seiko skmei",
Jam Tangan Wanita Bulan Bintang Menawan Berlian Palsu Warna-Warni Gelang Kulit Imitasi,"jam, gelang",
Best Seller Jam Tangan Pria G-SHOCK W048 Original Dual Time,"jam, tangan pria g",
SKMEI Casio Men Sport LED Watch Water Resistant 50m - AD0993 EMWS1EBK,"led, watch, water",
Jam Tangan Geneva Quartz Wanita Tali Kulit Imitasi Ramping,jam,
Jam Tangan Pria/Cowok Elegan Sport Casio G-Shock Dual Time Full Rubber Hitam Anti Air Original BM,jam,
Jam Tangan Modis Pria Wanita Stainless Steel Tali Kulit,jam,
Jam Quicksilver Tanggal Hari Coklat Muda *# CM #* ## QS001 ##,jam,
Jam Tangan iwatch U10 Smart Watch Touch Screen + GSM,"jam, watch, screen",
(New) SINCE TALI KARET + 2 Jam + 21 Tali Karet + 21 Ring Warna,"jam, ring",
Jam Tangan Wanita Analog Quartz Vogue Bertabur Berlian Buatan dengan Tali Kulit Cocok untuk Kadoi,jam,
Jam Tangan Unisex New Arrival Warna-Warni Dial Digital Bisa Dipindah Tali Kulit Imitasi,"jam, warna warni",
JAM TANGAN GUESS MERICA PERMATA 01 FULL GOLD **Full Gold ** FREE BOX KANCING ** #GS007#,"jam, box, kancing, merica permata, tangan",
Jam Tangan Quartz Wanita Geneva Unisex Stainless Steel dengan Kilau Kristal,jam,
Jam Since 21 Tali 2 jam / Jam Set 21 ring 21 Tali ||| 22222222222222 FREE BATERAI CADANGAN,"jam, ring, baterai, tali",
Jam Tangan Sporty Quartz Analog Bahan Kulit Imitasi Untuk Pria dan Wanita,jam,
JAM TANGAN SEVENFRIDAY / SILVER - LEATHER HITAM #SF001#,"jam, leather",
TERLARIS!! Jam Tangan Korek Elektrik,"jam, korek",
Best Seller Jam Tangan Pria G-SHOCK W048 Original Dual Time,"jam, tangan pria g",
Jam Tangan Quartz Analog Unisex Kratif Jimat Lubang Kaca Dial Segitiga Tali Kulit Imitasi,"jam, segitiga tali kulit",
Best Seller Jam Tangan Pria G-SHOCK W048 Original Dual Time,"jam, tangan pria g",
Jam Tangan iwatch U10 Smart Watch Touch Screen + GSM,"jam, watch, screen",
Jam Tangan Pria / SKMEI ORIGINAL / SKMEI 9115 / Casio SKMEI,"jam, skmei casio",
Jam Tangan Wanita Candy Color Kulit Tali,jam,
Jam Tangan LED Pasangan Untuk Pria dan Wanita,"jam, led",
JAM RANTE HITAM DAN SILVER CUSTOME,jam,
Jam Tangan Quartz Wanita Geneva Unisex Stainless Steel dengan Kilau Kristal,jam,
Box Bantal Jam Tangan,"box, bantal, jam",
Jam Tangan Ripcurl Tanggal Sabit CKT *RP008* Model Quicksilver Tanggal Hari,"jam, quicksilver tanggal",
Jam Tangan Couple QUICKSILVER BALOK CHRONO VARIASI LEATHER COKLAT TUA ## QS004 ##,"jam, leather",
Jam Quartz Cocok untuk Olahraga Kado,jam,
Jam Tangan Quartz Wanita Geneva Unisex Stainless Steel dengan Kilau Kristal,jam,
Jam Tangan Pria / cowok Rolex automatic Skelaton super,"jam, skelaton",
Jam Tangan Geneva Quartz Wanita Tali Kulit Imitasi Ramping,jam,
SL SKMEI Jam Tangan Kulit Fashion Analog Kasual untuk Wanita,jam,
Jam Tangan Pria/Cowok Elegan Sport Casio G-Shock Dual Time Full Rubber Hitam Anti Air Original BM,jam,
Smartwatch dz09 / u9,smartwatch,
Men's Cool Quartz Wrist Watch Cigarette Electronic Lighter USB Rechargeable,"watch, usb, quartz",
